Floor area (Building size),"Belaïd, Fateh, David Roubaud, and Emilios Galariotis. 2019. “Features of Residential Energy Consumption: Evidence from France Using an Innovative Multilevel Modelling Approach.” Energy Policy 125 (February):277–85. https://doi.org/10.1016/j.enpol.2018.11.007.

Burnett, J. Wesley, and L. Lynne Kiesling. 2022. “How Do Machines Predict Energy Use? Comparing Machine Learning Approaches for Modeling Household Energy Demand in the United States.” Energy Research and Social Science 91 (September). https://doi.org/10.1016/j.erss.2022.102715.

Estiri, Hossein, and Emilio Zagheni. 2019. “Age Matters: Ageing and Household Energy Demand in the United States.” Energy Research and Social Science 55 (September):62–70. https://doi.org/10.1016/j.erss.2019.05.006.

Tso, Geoffrey K.F., and Jingjing Guan. 2014. “A Multilevel Regression Approach to Understand Effects of Environment Indicators and Household Features on Residential Energy Consumption.” Energy 66 (March):722–31. https://doi.org/10.1016/j.energy.2014.01.056.

Kristensen, Martin Heine, Adam Brun, and Steffen Petersen. 2018. “Predicting Danish Residential Heating Energy Use from Publicly Available Building Characteristics.” Energy and Buildings 173 (August):28–37. https://doi.org/10.1016/j.enbuild.2018.05.011.

Zhang, Yan, Bak Koon Teoh, Maozhi Wu, Jiayu Chen, and Limao Zhang. 2023. “Data-Driven Estimation of Building Energy Consumption and GHG Emissions Using Explainable Artificial Intelligence.” Energy 262 (January). https://doi.org/10.1016/j.energy.2022.125468.

Huebner, Gesche M., Ian Hamilton, Zaid Chalabi, David Shipworth, and Tadj Oreszczyn. 2015. “Explaining Domestic Energy Consumption – The Comparative Contribution of Building Factors, Socio-Demographics, Behaviours and Attitudes.” Applied Energy 159 (December):589–600. https://doi.org/10.1016/j.apenergy.2015.09.028.

Antonopoulos, Chrissi, Alec Trusty, and Vivek Shandas. 2019. “The Role of Building Characteristics, Demographics, and Urban Heat Islands in Shaping Residential Energy Use.” City and Environment Interactions 3 (November):100021. https://doi.org/10.1016/j.cacint.2020.100021.

Liu, Xiaochen, and John Sweeney. 2012. “Modelling the Impact of Urban Form on Household Energy Demand and Related CO2 Emissions in the Greater Dublin Region.” Energy Policy 46 (July):359–69. https://doi.org/10.1016/j.enpol.2012.03.070.

Zhang, Ming, Yan Song, Peng Li, and Huanan Li. 2016. “Study on Affecting Factors of Residential Energy Consumption in Urban and Rural Jiangsu.” Renewable and Sustainable Energy Reviews 53 (January):330–37. https://doi.org/10.1016/j.rser.2015.08.043.

Lee, Gunwon, and Yunnam Jeong. 2017. “Impact of Urban and Building Form and Microclimate on the Energy Consumption of Buildings - Based on Statistical Analysis-.” Journal of Asian Architecture and Building Engineering 16 (3): 565–72. https://doi.org/10.3130/jaabe.16.565.

Jiang, Tingting, Hongyang Li, Peng Mao, Tongyuan Wu, Martin Skitmore, and Nima Talebian. 2023. “Strategy of Energy Conservation and Emission Reduction in Residential Building Sector: A Case Study of Jiangsu Province, China.” Edited by Yibin Ao. Journal of Environmental and Public Health 2023 (January):1–13. https://doi.org/10.1155/2023/7818070.

",0,"Goldstein, Benjamin, Tony G. Reames, and Joshua P. Newell. 2022. “Racial Inequity in Household Energy Efficiency and Carbon Emissions in the United States: An Emissions Paradox.” Energy Research and Social Science 84 (February). https://doi.org/10.1016/j.erss.2021.102365.

Pan, Yue, and Limao Zhang. 2020. “Data-Driven Estimation of Building Energy Consumption with Multi-Source Heterogeneous Data.” Applied Energy 268 (June). https://doi.org/10.1016/j.apenergy.2020.114965.

Ye, Zhongnan, Kuangly Cheng, Shu Chien Hsu, Hsi Hsien Wei, and Clara Man Cheung. 2021. “Identifying Critical Building-Oriented Features in City-Block-Level Building Energy Consumption: A Data-Driven Machine Learning Approach.” Applied Energy 301 (November). https://doi.org/10.1016/j.apenergy.2021.117453.

Cui, Peng, Jiaqi Lu, Yutong Wu, Jingnan Tang, and Jinjian Jiang. 2024. “Effect of Urban Morphology on Microclimate and Building Cluster Energy Consumption in Cold Regions of China.” Sustainable Cities and Society 115 (November):105838. https://doi.org/10.1016/j.scs.2024.105838.","Liu, Xue, Hao Tang, Yong Ding, and Da Yan. 2022. “Investigating the Performance of Machine Learning Models Combined with Different Feature Selection Methods to Estimate the Energy Consumption of Buildings.” Energy and Buildings 273 (October). https://doi.org/10.1016/j.enbuild.2022.112408.

Gao, Jingxin, Xiaoyang Zhong, Weiguang Cai, Hong Ren, Tengfei Huo, Xia Wang, and Zhifu Mi. 2019. “Dilution Effect of the Building Area on Energy Intensity in Urban Residential Buildings.” Nature Communications 10 (1). https://doi.org/10.1038/s41467-019-12852-9.

Chen, Yen Jong, Rodney H. Matsuoka, and Tzu Min Liang. 2018. “Urban Form, Building Characteristics, and Residential Electricity Consumption: A Case Study in Tainan City.” Environment and Planning B: Urban Analytics and City Science 45 (5): 933–52. https://doi.org/10.1177/2399808317690150.

Ahn, Yong Jin, and Dong Wook Sohn. 2019. “The Effect of Neighbourhood-Level Urban Form on Residential Building Energy Use: A GIS-Based Model Using Building Energy Benchmarking Data in Seattle.” Energy and Buildings 196 (August):124–33. https://doi.org/10.1016/j.enbuild.2019.05.018.

Kontokosta, Constantine E., and Christopher Tull. 2017. “A Data-Driven Predictive Model of City-Scale Energy Use in Buildings.” Applied Energy 197:303–17. https://doi.org/10.1016/j.apenergy.2017.04.005.

Zhang, Yan, Bak Koon Teoh, Limao Zhang, and Jiayu Chen. 2022. “Spatio-Temporal Heterogeneity Analysis of Energy Use in Residential Buildings.” Journal of Cleaner Production 352 (June):131422. https://doi.org/10.1016/j.jclepro.2022.131422.","Huang, Wen Hsiu. 2015. “The Determinants of Household Electricity Consumption in Taiwan: Evidence from Quantile Regression.” Energy 87 (July):120–33. https://doi.org/10.1016/j.energy.2015.04.101.

Sakah, Marriette, Stephane de la Rue du Can, Felix Amankwah Diawuo, Morkporkpor Delight Sedzro, and Christoph Kuhn. 2019. “A Study of Appliance Ownership and Electricity Consumption Determinants in Urban Ghanaian Households.” Sustainable Cities and Society 44 (January):559–81. https://doi.org/10.1016/j.scs.2018.10.019.

Chen, Yen Jong, Rodney H. Matsuoka, and Tzu Min Liang. 2018. “Urban Form, Building Characteristics, and Residential Electricity Consumption: A Case Study in Tainan City.” Environment and Planning B: Urban Analytics and City Science 45 (5): 933–52. https://doi.org/10.1177/2399808317690150.

Mohammadi, Saleh, Bauke de Vries, Azarakhsh Rafiee, Masoud Esfandiari, and Eduardo Dias. 2021. “An Exploratory Study on the Impact of Physical and Geospatial Characteristics of the Urban Built Environment on the Buildings Annual Electricity Usage.” Journal of Building Engineering 40 (August). https://doi.org/10.1016/j.jobe.2021.102359.

Ahmed Gassar, Abdo Abdullah, Geun Young Yun, and Sumin Kim. 2019. “Data-Driven Approach to Prediction of Residential Energy Consumption at Urban Scales in London.” Energy 187 (November). https://doi.org/10.1016/j.energy.2019.115973.

Huebner, Gesche, David Shipworth, Ian Hamilton, Zaid Chalabi, and Tadj Oreszczyn. 2016. “Understanding Electricity Consumption: A Comparative Contribution of Building Factors, Socio-Demographics, Appliances, Behaviours and Attitudes.” Applied Energy 177 (September):692–702. https://doi.org/10.1016/j.apenergy.2016.04.075.

Li, Chaosu, Yan Song, and Nikhil Kaza. 2018. “Urban Form and Household Electricity Consumption: A Multilevel Study.” Energy and Buildings 158 (January):181–93. https://doi.org/10.1016/j.enbuild.2017.10.007.

Adua, Lazarus, and Brett Clark. 2019. “Even for the Environment, Context Matters! States, Households, and Residential Energy Consumption.” Environmental Research Letters 14 (6): 064008. https://doi.org/10.1088/1748-9326/ab1abf.",0,"Steemers, Koen, and Geun Young Yun. 2009. “Household Energy Consumption: A Study of the Role of Occupants.” Building Research and Information 37 (5–6): 625–37. https://doi.org/10.1080/09613210903186661.

Chen, Shuqin, Nianping Li, Hiroshi Yoshino, Jun Guan, and Mark D. Levine. 2011. “Statistical Analyses on Winter Energy Consumption Characteristics of Residential Buildings in Some Cities of China.” Energy and Buildings 43 (5): 1063–70. https://doi.org/10.1016/j.enbuild.2010.09.022.",0,"Mostafavi, Nariman, Mohamad Farzinmoghadam, and Simi Hoque. 2017. “Urban Residential Energy Consumption Modeling in the Integrated Urban Metabolism Analysis Tool (IUMAT).” Building and Environment 114 (March):429–44. https://doi.org/10.1016/j.buildenv.2016.12.035.

Yun, Geun Young, and Koen Steemers. 2011. “Behavioural, Physical and Socio-Economic Factors in Household Cooling Energy Consumption.” Applied Energy 88 (6): 2191–2200. https://doi.org/10.1016/j.apenergy.2011.01.010.

Steemers, Koen, and Geun Young Yun. 2009. “Household Energy Consumption: A Study of the Role of Occupants.” Building Research and Information 37 (5–6): 625–37. https://doi.org/10.1080/09613210903186661.

Ko, Yekang, and John D Radke. 2014. “The Effect of Urban Form and Residential Cooling Energy Use in Sacramento, California.” Environment and Planning B: Planning and Design 41 (4): 573–93. https://doi.org/10.1068/b12038p.","Andreou, Andreas, John Barrett, Peter G. Taylor, Paul E. Brockway, and Zia Wadud. 2020. “Decomposing the Drivers of Residential Space Cooling Energy Consumption in EU-28 Countries Using a Panel Data Approach.” Energy and Built Environment 1 (4): 432–42. https://doi.org/10.1016/j.enbenv.2020.03.005.","Namazkhan, Maliheh, Casper Albers, and Linda Steg. 2020. “A Decision Tree Method for Explaining Household Gas Consumption: The Role of Building Characteristics, Socio-Demographic Variables, Psychological Factors and Household Behaviour.” Renewable and Sustainable Energy Reviews 119 (March). https://doi.org/10.1016/j.rser.2019.109542.

Brounen, Dirk, Nils Kok, and John M. Quigley. 2012. “Residential Energy Use and Conservation: Economics and Demographics.” European Economic Review 56 (5): 931–45. https://doi.org/10.1016/j.euroecorev.2012.02.007.

",0,"Wang, Lan, Eric W.M. Lee, Syed Asad Hussian, Anthony Chun Yin Yuen, and Wei Feng. 2021. “Quantitative Impact Analysis of Driving Factors on Annual Residential Building Energy End-Use Combining Machine Learning and Stochastic Methods.” Applied Energy 299 (October). https://doi.org/10.1016/j.apenergy.2021.117303.

Wiesmann, Daniel, Inĉs Lima Azevedo, Paulo Ferrão, and John E. Fernández. 2011. “Residential Electricity Consumption in Portugal: Findings from Top-down and Bottom-up Models.” Energy Policy 39 (5): 2772–79. https://doi.org/10.1016/j.enpol.2011.02.047.

Jiang, Lu, Xiaonan Shi, Shuang Wu, Bowenpeng Ding, and Yamei Chen. 2022. “What Factors Affect Household Energy Consumption in Mega-Cities? A Case Study of Guangzhou, China.” Journal of Cleaner Production 363 (August). https://doi.org/10.1016/j.jclepro.2022.132388.

Goldstein, Benjamin, Tony G. Reames, and Joshua P. Newell. 2022. “Racial Inequity in Household Energy Efficiency and Carbon Emissions in the United States: An Emissions Paradox.” Energy Research and Social Science 84 (February). https://doi.org/10.1016/j.erss.2021.102365.",0
Energy Performance Score (including codes and labels),0,"Belaïd, Fateh, David Roubaud, and Emilios Galariotis. 2019. “Features of Residential Energy Consumption: Evidence from France Using an Innovative Multilevel Modelling Approach.” Energy Policy 125 (February):277–85. https://doi.org/10.1016/j.enpol.2018.11.007.

Zhang, Yan, Bak Koon Teoh, Maozhi Wu, Jiayu Chen, and Limao Zhang. 2023. “Data-Driven Estimation of Building Energy Consumption and GHG Emissions Using Explainable Artificial Intelligence.” Energy 262 (January). https://doi.org/10.1016/j.energy.2022.125468.

Huebner, Gesche M., Ian Hamilton, Zaid Chalabi, David Shipworth, and Tadj Oreszczyn. 2015. “Explaining Domestic Energy Consumption – The Comparative Contribution of Building Factors, Socio-Demographics, Behaviours and Attitudes.” Applied Energy 159 (December):589–600. https://doi.org/10.1016/j.apenergy.2015.09.028.

Hachem, Caroline. 2016. “Impact of Neighborhood Design on Energy Performance and GHG Emissions.” Applied Energy 177 (September):422–34. https://doi.org/10.1016/j.apenergy.2016.05.117.",0,"Ahn, Yong Jin, and Dong Wook Sohn. 2019. “The Effect of Neighbourhood-Level Urban Form on Residential Building Energy Use: A GIS-Based Model Using Building Energy Benchmarking Data in Seattle.” Energy and Buildings 196 (August):124–33. https://doi.org/10.1016/j.enbuild.2019.05.018.

Zhang, Yan, Bak Koon Teoh, Limao Zhang, and Jiayu Chen. 2022. “Spatio-Temporal Heterogeneity Analysis of Energy Use in Residential Buildings.” Journal of Cleaner Production 352 (June):131422. https://doi.org/10.1016/j.jclepro.2022.131422.",0,0,0,0,0,0,0,0,0,0
Double glazing,0,"Belaïd, Fateh. 2016. “Understanding the Spectrum of Domestic Energy Consumption: Empirical Evidence from France.” Energy Policy 92 (May):220–33. https://doi.org/10.1016/j.enpol.2016.02.015.

Balaras, Constantinos A., Athina G. Gaglia, Elena Georgopoulou, Sevastianos Mirasgedis, Yiannis Sarafidis, and Dimitris P. Lalas. 2007. “European Residential Buildings and Empirical Assessment of the Hellenic Building Stock, Energy Consumption, Emissions and Potential Energy Savings.” Building and Environment 42 (3): 1298–1314. https://doi.org/10.1016/j.buildenv.2005.11.001.

Juaidi, Adel, Fadi AlFaris, Faris Saeed, Esther Salmeron-Manzano, and Francisco Manzano-Agugliaro. 2019. “Urban Design to Achieving the Sustainable Energy of Residential Neighbourhoods in Arid Climate.” Journal of Cleaner Production 228 (August):135–52. https://doi.org/10.1016/j.jclepro.2019.04.269.",0,0,0,0,0,0,0,0,0,0,0,0
Window area or WWR,"Lee, Gunwon, and Yunnam Jeong. 2017. “Impact of Urban and Building Form and Microclimate on the Energy Consumption of Buildings - Based on Statistical Analysis-.” Journal of Asian Architecture and Building Engineering 16 (3): 565–72.
https://doi.org/10.3130/jaabe.16.565.


",0,"Troup, Luke, Robert Phillips, Matthew J. Eckelman, and David Fannon. 2019. “Effect of Window-to-Wall Ratio on Measured Energy Consumption in US Office Buildings.” Energy and Buildings 203 (November): 109434. https://doi.org/10.1016/j.enbuild.2019.109434.",0,0,0,"Steemers, Koen, and Geun Young Yun. 2009. “Household Energy Consumption: A Study of the Role of Occupants.” Building Research and Information 37 (5–6): 625–37. https://doi.org/10.1080/09613210903186661.","Li, Gaomei, Cheng Sun, Mengcheng Sang, Shuqin Chen, Jinjin Li, Yunsun Han, and Shen Xu. 2024. “The Synergistic Effect of Multiple Design Factors on Building Energy Consumption of Office Blocks: A Case Study of Wuhan, China.” Journal of Building Engineering 95 (October):110200. https://doi.org/10.1016/j.jobe.2024.110200.","Troup, Luke, Robert Phillips, Matthew J. Eckelman, and David Fannon. 2019. “Effect of Window-to-Wall Ratio on Measured Energy Consumption in US Office Buildings.” Energy and Buildings 203 (November):109434. https://doi.org/10.1016/j.enbuild.2019.109434.

Li, Gaomei, Cheng Sun, Mengcheng Sang, Shuqin Chen, Jinjin Li, Yunsun Han, and Shen Xu. 2024. “The Synergistic Effect of Multiple Design Factors on Building Energy Consumption of Office Blocks: A Case Study of Wuhan, China.” Journal of Building Engineering 95 (October):110200. https://doi.org/10.1016/j.jobe.2024.110200.",0,0,0,"Wang, Lan, Eric W.M. Lee, Syed Asad Hussian, Anthony Chun Yin Yuen, and Wei Feng. 2021. “Quantitative Impact Analysis of Driving Factors on Annual Residential Building Energy End-Use Combining Machine Learning and Stochastic Methods.” Applied Energy 299 (October). https://doi.org/10.1016/j.apenergy.2021.117303.",0
Shading,0,0,0,0,0,0,0,0,0,"Mayrhofer, Lukas, Andreas Müller, Marianne Bügelmayer-Blaschek, Aadit Malla, and Lukas Kranzl. 2023. “Modelling the Effect of Passive Cooling Measures on Future Energy Needs for the Austrian Building Stock.” Energy and Buildings 296 (October):113333. https://doi.org/10.1016/j.enbuild.2023.113333.",0,0,0,0
Insulation,0,"Salvati, A., M. Palme, G. Chiesa, and M. Kolokotroni. 2020. “Built Form, Urban Climate and Building Energy Modelling: Case-Studies in Rome and Antofagasta.” Journal of Building Performance Simulation 13 (2): 209–25. https://doi.org/10.1080/19401493.2019.1707876.

Balaras, Constantinos A., Athina G. Gaglia, Elena Georgopoulou, Sevastianos Mirasgedis, Yiannis Sarafidis, and Dimitris P. Lalas. 2007. “European Residential Buildings and Empirical Assessment of the Hellenic Building Stock, Energy Consumption, Emissions and Potential Energy Savings.” Building and Environment 42 (3): 1298–1314. https://doi.org/10.1016/j.buildenv.2005.11.001.

Urquizo, Javier, Carlos Calderón, and Philip James. 2018. “Modelling Household Spatial Energy Intensity Consumption Patterns for Building Envelopes, Heating Systems and Temperature Controls in Cities.” Applied Energy 226 (September):670–81. https://doi.org/10.1016/j.apenergy.2018.05.125.

Juaidi, Adel, Fadi AlFaris, Faris Saeed, Esther Salmeron-Manzano, and Francisco Manzano-Agugliaro. 2019. “Urban Design to Achieving the Sustainable Energy of Residential Neighbourhoods in Arid Climate.” Journal of Cleaner Production 228 (August):135–52. https://doi.org/10.1016/j.jclepro.2019.04.269.

Marique, Anne Franoise, and Sigrid Reiter. 2012. “A Method to Evaluate the Energy Consumption of Suburban Neighborhoods.” In HVAC and R Research, 18:88–99. https://doi.org/10.1080/10789669.2011.592103.


",0,0,0,"Reyna, Janet L., and Mikhail V. Chester. 2017. “Energy Efficiency to Reduce Residential Electricity and Natural Gas Use under Climate Change.” Nature Communications 8 (May). https://doi.org/10.1038/ncomms14916.

Adua, Lazarus, and Brett Clark. 2019. “Even for the Environment, Context Matters! States, Households, and Residential Energy Consumption.” Environmental Research Letters 14 (6): 064008. https://doi.org/10.1088/1748-9326/ab1abf.",0,"Marique, Anne Franoise, and Sigrid Reiter. 2012. “A Method to Evaluate the Energy Consumption of Suburban Neighborhoods.” In HVAC and R Research, 18:88–99. https://doi.org/10.1080/10789669.2011.592103.

Streicher, Kai Nino, Pierryves Padey, David Parra, Meinrad C. Bürer, Stefan Schneider, and Martin K. Patel. 2019. “Analysis of Space Heating Demand in the Swiss Residential Building Stock: Element-Based Bottom-up Model of Archetype Buildings.” Energy and Buildings 184 (February):300–322. https://doi.org/10.1016/j.enbuild.2018.12.011.

Li, Gaomei, Cheng Sun, Mengcheng Sang, Shuqin Chen, Jinjin Li, Yunsun Han, and Shen Xu. 2024. “The Synergistic Effect of Multiple Design Factors on Building Energy Consumption of Office Blocks: A Case Study of Wuhan, China.” Journal of Building Engineering 95 (October):110200. https://doi.org/10.1016/j.jobe.2024.110200.

Hao, Ziyang, Xiaojing Zhang, Jingchao Xie, Kaili Yin, and Jiaping Liu. 2022. “Balance Point Temperature and Heating Degree-Days in Different Climate Conditions for Building Energy Efficiency Applications.” Building and Environment 216 (May):109013. https://doi.org/10.1016/j.buildenv.2022.109013.",0,0,0,"Brounen, Dirk, Nils Kok, and John M. Quigley. 2012.
“Residential Energy Use and Conservation: Economics and Demographics.” European Economic Review 56 (5): 931–45. https://doi.org/10.1016/j.euroecorev.2012.02.007.

","Wang, Lan, Eric W.M. Lee, Syed Asad Hussian, Anthony Chun Yin Yuen, and Wei Feng. 2021. “Quantitative Impact Analysis of Driving Factors on Annual Residential Building Energy End-Use Combining Machine Learning and Stochastic Methods.” Applied Energy 299 (October). https://doi.org/10.1016/j.apenergy.2021.117303.",0
Orientation (north-south),0,"Juaidi, Adel, Fadi AlFaris, Faris Saeed, Esther Salmeron-Manzano, and Francisco Manzano-Agugliaro. 2019. “Urban Design to Achieving the Sustainable Energy of Residential Neighbourhoods in Arid Climate.” Journal of Cleaner Production 228 (August):135–52. https://doi.org/10.1016/j.jclepro.2019.04.269.

Lee, Gunwon, and Yunnam Jeong. 2017. “Impact of Urban and Building Form and Microclimate on the Energy Consumption of Buildings - Based on Statistical Analysis-.” Journal of Asian Architecture and Building Engineering 16 (3): 565–72. https://doi.org/10.3130/jaabe.16.565.",0,0,0,0,0,"Mangan, Suzi Dilara, and Gül Koçlar Oral. 2020. “Impacts of Future Weather Data on the Energy Performance of Buildings in the Context of 
Urban Geometry.” Edited by Giuseppe Brando. Cogent Engineering 7 (1): 1714112. https://doi.org/10.1080/23311916.2020.1714112.",0,"Braulio-Gonzalo, Marta, María Dolores Bovea, María José Ruá, and Pablo Juan. 2016. “A Methodology for Predicting the Energy Performance and Indoor Thermal Comfort of Residential Stocks on the Neighbourhood and City Scales. A Case Study in Spain.” Journal of Cleaner Production 139 (December):646–65. https://doi.org/10.1016/j.jclepro.2016.08.059.

Shareef, Sundus. 2021. “The Impact of Urban Morphology and Building’s Height Diversity on Energy Consumption at Urban Scale. The Case Study of Dubai.” Building and Environment 194 (May). https://doi.org/10.1016/j.buildenv.2021.107675.

Mangan, Suzi Dilara, and Gül Koçlar Oral. 2020. “Impacts of Future Weather Data on the Energy Performance of Buildings in the Context of Urban Geometry.” Edited by Giuseppe Brando. Cogent Engineering 7 (1): 1714112. https://doi.org/10.1080/23311916.2020.1714112.
",0,0,0,0
Material (wood),0,0,"Bansal, P, and S Quan. 2024. “Examining Behavioral Aspect of Urban Context Effect on Residential Building Energy Use in Seoul – Linking Urban Walkability to Energy.” Building and Environment 252 (March). https://doi.org/10.1016/j.buildenv.2024.111179.

Bansal, Parth, and Steven Jige Quan. 2022. “Relationships between Building Characteristics, Urban Form and Building Energy Use in Different Local Climate Zone Contexts: An Empirical Study in Seoul.” Energy and Buildings 272 (October). https://doi.org/10.1016/j.enbuild.2022.112335.",0,0,0,0,0,0,0,0,0,0,0
Material (reinforced concrete),0,0,0,"Bansal, P, and S Quan. 2024. “Examining Behavioral Aspect of Urban Context Effect on Residential Building Energy Use in Seoul – Linking Urban Walkability to Energy.” Building and Environment 252 (March). https://doi.org/10.1016/j.buildenv.2024.111179.

Bansal, Parth, and Steven Jige Quan. 2022. “Relationships between Building Characteristics, Urban Form and Building Energy Use in Different Local Climate Zone Contexts: An Empirical Study in Seoul.” Energy and Buildings 272 (October). https://doi.org/10.1016/j.enbuild.2022.112335.",0,"Kim, Hyunsoo, Youngwoo Kwon, and Yeol Choi. 2022. “Determinants of Electricity Consumption of Energy-Vulnerable Group Using 
Ensemble Gradient-Boosting Algorithm.” KSCE Journal of Civil Engineering 26 (12): 5010–21. https://doi.org/10.1007/s12205-022-1984-2.",0,0,0,0,0,0,0,0
Material (composite board),0,0,0,"Bansal, Parth, and Steven Jige Quan. 2022. “Relationships between Building Characteristics, Urban Form and Building Energy Use in Different Local Climate Zone Contexts: An Empirical Study in Seoul.” Energy and Buildings 272 (October). https://doi.org/10.1016/j.enbuild.2022.112335.",0,0,0,0,0,0,0,0,0,0
Material (albedo) ,0,"Douthat, Thomas, John D. Morgan, Haris Alibašić, and Aneurin Grant. 2020. “Passive Building Characteristics, and Summertime Residential Energy Use: A Spatial Analysis of Energy Efficiency in Gainesville, FL.” 
Building and Environment 169 (February):106542. https://doi.org/10.1016/j.buildenv.2019.106542.

Adilkhanova, Indira, Mat Santamouris, and Geun Young Yun. 2023. “Coupling Urban Climate Modeling and City-Scale Building Energy Simulations with the Statistical Analysis: Climate and Energy Implications of High Albedo Materials in Seoul.” Energy and Buildings 290 (July):113092. https://doi.org/10.1016/j.enbuild.2023.113092.",0,0,0,0,0,0,0,"Haddad, Shamila, Wanni Zhang, Riccardo Paolini, Kai Gao, Muzahim Altheeb, Abdulrahman Al Mogirah, Abdullatif Bin Moammar, et al. 2024. “Quantifying the Energy Impact of Heat Mitigation Technologies at the Urban Scale.” Nature Cities 1 (1): 62–72. https://doi.org/10.1038/s44284-023-00005-5.",0,0,0,0
Material (cool),0,"Xu, Fusuo, Dongdong Tian, Zhi Gao, and Jianshun Jensen Zhang. 2024. “The Effects of Cool Materials, Façade Orientation, and Morphological Parameters on Energy Consumption at the Residential Neighborhood Scale.” Building Simulation 17 (4): 525–42. https://doi.org/10.1007/s12273-023-1096-z.",0,0,0,0,0,0,0,0,0,0,0,"Zonato, A., A. Martilli, E. Gutierrez, F. Chen, C. He, M. Barlage, D. Zardi,
and L. Giovannini. 2021. “Exploring the Effects of Rooftop Mitigation Strategies on Urban Temperatures and Energy Consumption.” Journal of Geophysical Research: Atmospheres 126 (21): e2021JD035002. https://doi.org/10.1029/2021JD035002."
Roof shape (flat),"Lee, Gunwon, and Yunnam Jeong. 2017. “Impact of Urban and Building Form and Microclimate on the Energy Consumption of Buildings - Based on Statistical Analysis-.” Journal of Asian Architecture and Building Engineering 16 (3): 565–72. 
https://doi.org/10.3130/jaabe.16.565.",0,0,0,0,0,0,0,0,0,0,0,0,0
