Energy efficiency awareness,0,"Belaïd, Fateh, David Roubaud, and Emilios Galariotis. 2019. “Features of Residential Energy Consumption: Evidence from France Using an Innovative Multilevel Modelling Approach.” Energy Policy 125 (February):277–85. https://doi.org/10.1016/j.enpol.2018.11.007.

Mrówczyńska, Maria, Marta Skiba, Anna Bazan-Krzywoszańska, and Małgorzata Sztubecka. 2020. “Household Standards and Socio-Economic Aspects as a Factor Determining Energy Consumption in the City.” Applied Energy 264 (April). https://doi.org/10.1016/j.apenergy.2020.114680.

Huebner, Gesche M., Ian Hamilton, Zaid Chalabi, David Shipworth, and Tadj Oreszczyn. 2015. “Explaining Domestic Energy Consumption – The Comparative Contribution of Building Factors, Socio-Demographics, Behaviours and Attitudes.” Applied Energy 159 (December):589–600. https://doi.org/10.1016/j.apenergy.2015.09.028.",0,0,0,"Sakah, Marriette, Stephane de la Rue du Can, Felix Amankwah Diawuo, Morkporkpor Delight Sedzro, and Christoph Kuhn. 2019. “A Study of Appliance Ownership and Electricity Consumption Determinants in Urban Ghanaian Households.” Sustainable Cities and Society 44 (January):559–81. https://doi.org/10.1016/j.scs.2018.10.019.

Nsangou, Jean Calvin, Joseph Kenfack, Urbain Nzotcha, Paul Salomon Ngohe Ekam, Joseph Voufo, and Thomas T. Tamo. 2022. “Explaining Household Electricity Consumption Using Quantile Regression, Decision Tree and Artificial Neural Network.” Energy 250 (July). https://doi.org/10.1016/j.energy.2022.123856.

Huebner, Gesche, David Shipworth, Ian Hamilton, Zaid Chalabi, and Tadj Oreszczyn. 2016. “Understanding Electricity Consumption: A Comparative Contribution of Building Factors, Socio-Demographics, Appliances, Behaviours and Attitudes.” Applied Energy 177 (September):692–702. https://doi.org/10.1016/j.apenergy.2016.04.075.",0,0,0,0,0,0,0,0
Efficient operation practices or management,0,"

Huebner, Gesche M., Ian Hamilton, Zaid Chalabi, David Shipworth, and Tadj Oreszczyn. 2015. “Explaining Domestic Energy Consumption – The Comparative Contribution of Building Factors, Socio-Demographics, Behaviours and Attitudes.” Applied Energy 159 (December):589–600. https://doi.org/10.1016/j.apenergy.2015.09.028.

Marique, Anne Franoise, and Sigrid Reiter. 2012. “A Method to Evaluate the Energy Consumption of Suburban Neighborhoods.” In HVAC and R Research, 18:88–99. https://doi.org/10.1080/10789669.2011.592103.",0,"Bansal, Parth, and Steven Jige Quan. 2022. “Relationships between Building Characteristics, Urban Form and Building Energy Use in Different Local Climate Zone Contexts: An Empirical Study in Seoul.” Energy and Buildings 272 (October). https://doi.org/10.1016/j.enbuild.2022.112335.",0,0,0,"Marique, Anne Franoise, and Sigrid Reiter. 2012. “A Method to Evaluate the Energy Consumption of Suburban Neighborhoods.” In HVAC and R Research, 18:88–99. https://doi.org/10.1080/10789669.2011.592103.",0,0,0,"Namazkhan, Maliheh, Casper Albers, and Linda Steg. 2020. “A Decision Tree Method for Explaining Household Gas Consumption: The Role of Building Characteristics, Socio-Demographic Variables, Psychological Factors and Household Behaviour.” Renewable and Sustainable Energy Reviews 119 (March). https://doi.org/10.1016/j.rser.2019.109542.",0,0
Night ventilation,0,0,0,0,0,0,0,0,0,"Mayrhofer, Lukas, Andreas Müller, Marianne Bügelmayer-Blaschek, Aadit Malla, and Lukas Kranzl. 2023. “Modelling the Effect of Passive Cooling Measures on Future Energy Needs for the Austrian Building Stock.” Energy and Buildings 296 (October):113333. https://doi.org/10.1016/j.enbuild.2023.113333.",0,0,0,0
Cooling setpoint temperature ,0,"Belaïd, Fateh, David Roubaud, and Emilios Galariotis. 2019. “Features of Residential Energy Consumption: Evidence from France Using an Innovative Multilevel Modelling Approach.” Energy Policy 125 (February):277–85. https://doi.org/10.1016/j.enpol.2018.11.007.

Jaffar, Badria, Tadj Oreszczyn, Rokia Raslan, and Alex Summerfield. 2018. “Understanding Energy Demand in Kuwaiti Villas: Findings from a Quantitative Household Survey.” Energy and Buildings 165 (April):379–89. https://doi.org/10.1016/j.enbuild.2018.01.055.

Mohammadiziazi, Rezvan, Samuel Copeland, and Melissa M. Bilec. 2021. “Urban Building Energy Model: Database Development, Validation, and Application for Commercial Building Stock.” Energy and Buildings 248 (October). https://doi.org/10.1016/j.enbuild.2021.111175.",0,0,0,0,0,0,0,"Mayrhofer, Lukas, Andreas Müller, Marianne Bügelmayer-Blaschek, Aadit 
Malla, and Lukas Kranzl. 2023. “Modelling the Effect of Passive Cooling Measures on Future Energy Needs for the Austrian Building Stock.” Energy and Buildings 296 (October):113333. https://doi.org/10.1016/j.enbuild.2023.113333.",0,0,0,0
Heating setpoint temperature,"Belaïd, Fateh, David Roubaud, and Emilios Galariotis. 2019. “Features of Residential Energy Consumption: Evidence from France Using an Innovative Multilevel Modelling Approach.” Energy Policy 125 (February):277–85. https://doi.org/10.1016/j.enpol.2018.11.007.

Burnett, J. Wesley, and L. Lynne Kiesling. 2022. “How Do Machines Predict Energy Use? Comparing Machine Learning Approaches for Modeling Household Energy Demand in the United States.” Energy Research and Social Science 91 (September). https://doi.org/10.1016/j.erss.2022.102715. 

Mohammadiziazi, Rezvan, Samuel Copeland, and Melissa M. Bilec. 2021. “Urban Building Energy Model: Database Development, Validation, and Application for Commercial Building Stock.” Energy and Buildings 248 (October). https://doi.org/10.1016/j.enbuild.2021.111175.",0,0,0,0,0,"Staffell, Iain, Stefan Pfenninger, and Nathan Johnson. 2023. “A Global Model of Hourly Space Heating and Cooling Demand at Multiple Spatial Scales.” Nature Energy. https://doi.org/10.1038/s41560-023-01341-5.",0,0,0,0,0,"Wang, Lan, Eric W.M. Lee, Syed Asad Hussian, Anthony Chun Yin Yuen, and Wei Feng. 2021. “Quantitative Impact Analysis of Driving Factors on Annual Residential Building Energy End-Use Combining Machine Learning and Stochastic Methods.” Applied Energy 299 (October). https://doi.org/10.1016/j.apenergy.2021.117303.",0
HVAC usage duration or frequency,"
Kaza, Nikhil. 2010. “Understanding the Spectrum of Residential Energy Consumption: A Quantile Regression Approach.” Energy Policy 38 (11): 6574–85. https://doi.org/10.1016/j.enpol.2010.06.028.",0,0,0,0,0,"Chen, Shuqin, Nianping Li, Hiroshi Yoshino, Jun Guan, and Mark D. Levine. 2011. “Statistical Analyses on Winter Energy Consumption Characteristics of Residential Buildings in Some Cities of China.” Energy and Buildings 43 (5): 1063–70. https://doi.org/10.1016/j.enbuild.2010.09.022.",0,"Yun, Geun Young, and Koen Steemers. 2011. “Behavioural, Physical and Socio-Economic Factors in Household Cooling Energy Consumption.” Applied Energy 88 (6): 2191–2200. https://doi.org/10.1016/j.apenergy.2011.01.010.

Steemers, Koen, and Geun Young Yun. 2009. “Household Energy Consumption: A Study of the Role of Occupants.” Building Research and Information 37 (5–6): 625–37. https://doi.org/10.1080/09613210903186661.

Andreou, Andreas, John Barrett, Peter G. Taylor, Paul E. Brockway, and Zia Wadud. 2020. “Decomposing the Drivers of Residential Space Cooling Energy Consumption in EU-28 Countries Using a Panel Data Approach.” Energy and Built Environment 1 (4): 432–42. https://doi.org/10.1016/j.enbenv.2020.03.005.


",0,0,0,0,0
HVAC maintenance,0,"Balaras, Constantinos A., Athina G. Gaglia, Elena Georgopoulou, Sevastianos Mirasgedis, Yiannis Sarafidis, and Dimitris P. Lalas. 2007. “European Residential Buildings and Empirical Assessment of the
 Hellenic Building Stock, Energy Consumption, Emissions and Potential Energy Savings.” Building and Environment 42 (3): 1298–1314. https://doi.org/10.1016/j.buildenv.2005.11.001.",0,0,0,0,0,0,0,0,0,0,0,0
Satisfaction with temperature,0,0,0,0,0,0,"Chen, Shuqin, Nianping Li, Hiroshi Yoshino, Jun Guan, and Mark D. Levine. 2011. “Statistical Analyses on Winter Energy Consumption Characteristics of Residential Buildings in Some Cities of China.” Energy and Buildings 43 (5): 1063–70. https://doi.org/10.1016/j.enbuild.2010.09.022.",0,0,0,0,0,0,0
Occupancy level,"Tso, Geoffrey K.F., and Jingjing Guan. 2014. “A Multilevel Regression Approach to Understand Effects of Environment Indicators and Household Features on Residential Energy Consumption.” Energy 66 (March):722–31. https://doi.org/10.1016/j.energy.2014.01.056.",0,0,0,0,0,0,0,0,0,0,0,0,0
Building age,"Estiri, Hossein, and Emilio Zagheni. 2019. “Age Matters: Ageing and Household Energy Demand in the United States.” Energy Research and Social Science 55 (September):62–70. https://doi.org/10.1016/j.erss.2019.05.006.

Froemelt, Andreas, René Buffat, and Stefanie Hellweg. 2020. “Machine Learning Based Modeling of Households: A Regionalized Bottom-up Approach to Investigate Consumption-Induced Environmental Impacts.” Journal of Industrial Ecology 24 (3): 639–52. https://doi.org/10.1111/jiec.12969.

Jaffar, Badria, Tadj Oreszczyn, Rokia Raslan, and Alex Summerfield. 2018. “Understanding Energy Demand in Kuwaiti Villas: Findings from a Quantitative Household Survey.” Energy and Buildings 165 (April):379–89. https://doi.org/10.1016/j.enbuild.2018.01.055.

Tso, Geoffrey K.F., and Jingjing Guan. 2014. “A Multilevel Regression Approach to Understand Effects of Environment Indicators and Household Features on Residential Energy Consumption.” Energy 66 (March):722–31. https://doi.org/10.1016/j.energy.2014.01.056. 

Ahn, Yong Jin, and Dong Wook Sohn. 2019. “The Effect of Neighbourhood-Level Urban Form on Residential Building Energy Use: A GIS-Based Model Using Building Energy Benchmarking Data in Seattle.” Energy and Buildings 196 (August):124–33. https://doi.org/10.1016/j.enbuild.2019.05.018.

Porse, Erik, Joshua Derenski, Hannah Gustafson, Zoe Elizabeth, and Stephanie Pincetl. 2016. “Structural, Geographic, and Social Factors in Urban Building Energy Use: Analysis of Aggregated Account-Level Consumption Data in a Megacity.” Energy Policy 96 (September):179–92. https://doi.org/10.1016/j.enpol.2016.06.002.

Prataviera, Enrico, Pierdonato Romano, Laura Carnieletto, Francesco Pirotti, Jacopo Vivian, and Angelo Zarrella. 2021. “EUReCA: An Open-Source Urban Building Energy Modelling Tool for the Efficient Evaluation of Cities Energy Demand.” Renewable Energy 173 (August):544–60. https://doi.org/10.1016/j.renene.2021.03.144.

Kristensen, Martin Heine, Adam Brun, and Steffen Petersen. 2018. “Predicting Danish Residential Heating Energy Use from Publicly Available Building Characteristics.” Energy and Buildings 173 (August):28–37. https://doi.org/10.1016/j.enbuild.2018.05.011.

Mashhoodi, Bardia, Dominic Stead, and Arjan Van Timmeren. 2020. “Local and National Determinants of Household Energy Consumption in the Netherlands.” GeoJournal 85 (2): 393–406. https://doi.org/10.1007/s10708-018-09967-9.

Liu, Xiaochen, and John Sweeney. 2012. “Modelling the Impact of Urban Form on Household Energy Demand and Related CO2 Emissions in the Greater Dublin Region.” Energy Policy 46 (July):359–69. https://doi.org/10.1016/j.enpol.2012.03.070.

Hu, Shan, Da Yan, Ying Cui, and Siyue Guo. 2016. “Urban Residential Heating in Hot Summer and Cold Winter Zones of China—Status, Modeling, and Scenarios to 2030.” Energy Policy 92 (May):158–70. https://doi.org/10.1016/j.enpol.2016.01.032.","Kontokosta, Constantine E., and Christopher Tull. 2017. “A Data-Driven Predictive Model of City-Scale Energy Use in Buildings.” Applied Energy 197:303–17. https://doi.org/10.1016/j.apenergy.2017.04.005.","Bansal, P, and S Quan. 2024. “Examining Behavioral Aspect of Urban Context Effect on Residential Building Energy Use in Seoul – Linking Urban Walkability to Energy.” Building and Environment 252 (March). https://doi.org/10.1016/j.buildenv.2024.111179.

Jiang, Lu, Xiaonan Shi, Shuang Wu, Bowenpeng Ding, and Yamei Chen. 2022. “What Factors Affect Household Energy Consumption in Mega-Cities? A Case Study of Guangzhou, China.” Journal of Cleaner Production 363 (August). https://doi.org/10.1016/j.jclepro.2022.132388.

Goldstein, Benjamin, Tony G. Reames, and Joshua P. Newell. 2022. “Racial Inequity in Household Energy Efficiency and Carbon Emissions in the United States: An Emissions Paradox.” Energy Research and Social Science 84 (February). https://doi.org/10.1016/j.erss.2021.102365.

Porse, Erik, Joshua Derenski, Hannah Gustafson, Zoe Elizabeth, and Stephanie Pincetl. 2016. “Structural, Geographic, and Social Factors in Urban Building Energy Use: Analysis of Aggregated Account-Level Consumption Data in a Megacity.” Energy Policy 96 (September):179–92. https://doi.org/10.1016/j.enpol.2016.06.002.

Marique, Anne Franoise, and Sigrid Reiter. 2012. “A Method to Evaluate the Energy Consumption of Suburban Neighborhoods.” In HVAC and R Research, 18:88–99. https://doi.org/10.1080/10789669.2011.592103.

Bansal, Parth, and Steven Jige Quan. 2022. “Relationships between Building Characteristics, Urban Form and Building Energy Use in Different Local Climate Zone Contexts: An Empirical Study in Seoul.” Energy and Buildings 272 (October). https://doi.org/10.1016/j.enbuild.2022.112335.

Pan, Yue, and Limao Zhang. 2020. “Data-Driven Estimation of Building Energy Consumption with Multi-Source Heterogeneous Data.” Applied Energy 268 (June). https://doi.org/10.1016/j.apenergy.2020.114965.

Streicher, Kai Nino, Pierryves Padey, David Parra, Meinrad C. Bürer, Stefan Schneider, and Martin K. Patel. 2019. “Analysis of Space Heating Demand in the Swiss Residential Building Stock: Element-Based Bottom-up Model of Archetype Buildings.” Energy and Buildings 184 (February):300–322. https://doi.org/10.1016/j.enbuild.2018.12.011.

Neo, Hui Yun Rebecca, Nyuk Hien Wong, Marcel Ignatius, Chao Yuan, Yong Xu, and Kai Cao. 2023. “Spatial Analysis of Public Residential Housing’s Electricity Consumption in Relation to Urban Landscape and Building Characteristics: A Case Study in Singapore.” Energy & Environment 34 (2): 233–54. https://doi.org/10.1177/0958305X211056031.","Chen, Yen Jong, Rodney H. Matsuoka, and Tzu Min Liang. 2018. “Urban Form, Building Characteristics, and Residential Electricity Consumption: A Case Study in Tainan City.” Environment and Planning B: Urban Analytics and City Science 45 (5): 933–52. https://doi.org/10.1177/2399808317690150.

Silva, Ricardo, Sven Eggimann, Léonie Fierz, Massimo Fiorentini, Kristina Orehounig, and Luca Baldini. 2022. “Opportunities for Passive Cooling to Mitigate the Impact of Climate Change in Switzerland.” Building and Environment 208 (January). https://doi.org/10.1016/j.buildenv.2021.108574.","Navamuel, Elena Lasarte, Fernando Rubiera Morollón, and Blanca Moreno Cuartas. 2018. “Energy Consumption and Urban Sprawl: Evidence for the Spanish Case.” Journal of Cleaner Production 172 (January):3479–86. https://doi.org/10.1016/j.jclepro.2017.08.110.

Reyna, Janet L., and Mikhail V. Chester. 2017. “Energy Efficiency to Reduce Residential Electricity and Natural Gas Use under Climate Change.” Nature Communications 8 (May). https://doi.org/10.1038/ncomms14916.

Kim, Hyunsoo, Youngwoo Kwon, and Yeol Choi. 2022. “Determinants of Electricity Consumption of Energy-Vulnerable Group Using Ensemble Gradient-Boosting Algorithm.” KSCE Journal of Civil Engineering 26 (12): 5010–21. https://doi.org/10.1007/s12205-022-1984-2.","Chen, Yen Jong, Rodney H. Matsuoka, and Tzu Min Liang. 2018. “Urban Form, Building Characteristics, and Residential Electricity Consumption: A Case Study in Tainan City.” Environment and Planning B: Urban Analytics and City Science 45 (5): 933–52. https://doi.org/10.1177/2399808317690150.

Mohammadi, Saleh, Bauke de Vries, Azarakhsh Rafiee, Masoud Esfandiari, and Eduardo Dias. 2021. “An Exploratory Study on the Impact of Physical and Geospatial Characteristics of the Urban Built Environment on the Buildings Annual Electricity Usage.” Journal of Building Engineering 40 (August). https://doi.org/10.1016/j.jobe.2021.102359.

Kontokosta, Constantine E., and Christopher Tull. 2017. “A Data-Driven Predictive Model of City-Scale Energy Use in Buildings.” Applied Energy 197:303–17. https://doi.org/10.1016/j.apenergy.2017.04.005.

Movahedi, Ali, and Sybil Derrible. 2021. “Interrelationships between Electricity, Gas, and Water Consumption in Large-Scale Buildings.” Journal of Industrial Ecology 25 (4): 932–47. https://doi.org/10.1111/jiec.13097.","Mostafavi, Nariman, Mohamad Farzinmoghadam, and Simi Hoque. 2017. “Urban Residential Energy Consumption Modeling in the Integrated Urban Metabolism Analysis Tool (IUMAT).” Building and Environment 114 (March):429–44. https://doi.org/10.1016/j.buildenv.2016.12.035.

Steemers, Koen, and Geun Young Yun. 2009. “Household Energy Consumption: A Study of the Role of Occupants.” Building Research and Information 37 (5–6): 625–37. https://doi.org/10.1080/09613210903186661.

Streicher, Kai Nino, Pierryves Padey, David Parra, Meinrad C. Bürer, Stefan Schneider, and Martin K. Patel. 2019. “Analysis of Space Heating Demand in the Swiss Residential Building Stock: Element-Based Bottom-up Model of Archetype Buildings.” Energy and Buildings 184 (February):300–322. https://doi.org/10.1016/j.enbuild.2018.12.011.

Vecchi, Francesca, Umberto Berardi, and Guglielmina Mutani. 2023. “Data-Driven Urban Building Energy Models for the Platform of Toronto.” Energy Efficiency 16 (4). https://doi.org/10.1007/s12053-023-10106-8.

Braulio-Gonzalo, Marta, María Dolores Bovea, María José Ruá, and Pablo Juan. 2016. “A Methodology for Predicting the Energy Performance and Indoor Thermal Comfort of Residential Stocks on the Neighbourhood and City Scales. A Case Study in Spain.” Journal of Cleaner Production 139 (December):646–65. https://doi.org/10.1016/j.jclepro.2016.08.059.",0,"Mostafavi, Nariman, Mohamad Farzinmoghadam, and Simi Hoque. 2017. “Urban Residential Energy Consumption Modeling in the Integrated Urban Metabolism Analysis Tool (IUMAT).” Building and Environment 114 (March):429–44. https://doi.org/10.1016/j.buildenv.2016.12.035.

Braulio-Gonzalo, Marta, María Dolores Bovea, María José Ruá, and Pablo Juan. 2016. “A Methodology for Predicting the Energy Performance and Indoor Thermal Comfort of Residential Stocks on the Neighbourhood and City Scales. A Case Study in Spain.” Journal of Cleaner Production 139 (December):646–65. https://doi.org/10.1016/j.jclepro.2016.08.059.

Ko, Yekang, and John D Radke. 2014. “The Effect of Urban Form and Residential Cooling Energy Use in Sacramento, California.” Environment and Planning B: Planning and Design 41 (4): 573–93. https://doi.org/10.1068/b12038p.","Silva, Ricardo, Sven Eggimann, Léonie Fierz, Massimo Fiorentini, Kristina Orehounig, and Luca Baldini. 2022. “Opportunities for Passive Cooling to Mitigate the Impact of Climate Change in Switzerland.” Building and Environment 208 (January). https://doi.org/10.1016/j.buildenv.2021.108574.","Brounen, Dirk, Nils Kok, and John M. Quigley. 2012. “Residential Energy  Use and Conservation: Economics and Demographics.” European Economic Review 56 (5): 931–45. https://doi.org/10.1016/j.euroecorev.2012.02.007.

",0,0,0
Housing type (single-family detached) ,"Belaïd, Fateh, David Roubaud, and Emilios Galariotis. 2019. “Features of Residential Energy Consumption: Evidence from France Using an Innovative Multilevel Modelling Approach.” Energy Policy 125 (February):277–85. https://doi.org/10.1016/j.enpol.2018.11.007.

Estiri, Hossein, and Emilio Zagheni. 2019. “Age Matters: Ageing and Household Energy Demand in the United States.” Energy Research and Social Science 55 (September):62–70. https://doi.org/10.1016/j.erss.2019.05.006.

Tso, Geoffrey K.F., and Jingjing Guan. 2014. “A Multilevel Regression Approach to Understand Effects of Environment Indicators and Household Features on Residential Energy Consumption.” Energy 66 (March):722–31. https://doi.org/10.1016/j.energy.2014.01.056.

Elnakat, Afamia, Juan D. Gomez, and Nathlie Booth. 2016. “A Zip Code Study of Socioeconomic, Demographic, and Household Gendered Influence on the Residential Energy Sector.” Energy Reports 2 (November):21–27. https://doi.org/10.1016/j.egyr.2016.01.003.

Dar-Mousa, Rami Nabil, and Zeyad Makhamreh. 2019. “Analysis of the Pattern of Energy Consumptions and Its Impact on Urban Environmental Sustainability in Jordan: Amman City as a Case Study.” Energy, Sustainability and Society 9 (1): 15. https://doi.org/10.1186/s13705-019-0197-0.",0,"Silva, Ricardo, Sven Eggimann, Léonie Fierz, Massimo Fiorentini, Kristina Orehounig, and Luca Baldini. 2022. “Opportunities for Passive Cooling to Mitigate the Impact of Climate Change in Switzerland.” Building and Environment 208 (January). https://doi.org/10.1016/j.buildenv.2021.108574.",0,"Fan, H., I. F. MacGill, and A. B. Sproul. 2015. “Statistical Analysis of Driving Factors of Residential Energy Demand in the Greater Sydney Region, Australia.” Energy and Buildings 105 (August):9–25. https://doi.org/10.1016/j.enbuild.2015.07.030.

Mohammadi, Saleh, Bauke de Vries, Azarakhsh Rafiee, Masoud Esfandiari, and Eduardo Dias. 2021. “An Exploratory Study on the Impact of Physical and Geospatial Characteristics of the Urban Built Environment on the Buildings Annual Electricity Usage.” Journal of Building Engineering 40 (August). https://doi.org/10.1016/j.jobe.2021.102359.

Li, Chaosu, Yan Song, and Nikhil Kaza. 2018. “Urban Form and Household Electricity Consumption: A Multilevel Study.” Energy and Buildings 158 (January):181–93. https://doi.org/10.1016/j.enbuild.2017.10.007.",0,"Mostafavi, Nariman, Mohamad Farzinmoghadam, and Simi Hoque. 2017. “Urban Residential Energy Consumption Modeling in the Integrated Urban Metabolism Analysis Tool (IUMAT).” Building and Environment 114 (March):429–44. https://doi.org/10.1016/j.buildenv.2016.12.035.

Marique, Anne Franoise, and Sigrid Reiter. 2012. “A Method to Evaluate the Energy Consumption of Suburban Neighborhoods.” In HVAC and R Research, 18:88–99. https://doi.org/10.1080/10789669.2011.592103.

Streicher, Kai Nino, Pierryves Padey, David Parra, Meinrad C. Bürer, Stefan Schneider, and Martin K. Patel. 2019. “Analysis of Space Heating Demand in the Swiss Residential Building Stock: Element-Based Bottom-up Model of Archetype Buildings.” Energy and Buildings 184 (February):300–322. https://doi.org/10.1016/j.enbuild.2018.12.011.",0,"Mostafavi, Nariman, Mohamad Farzinmoghadam, and Simi Hoque. 2017. “Urban Residential Energy Consumption Modeling in the Integrated Urban Metabolism Analysis Tool (IUMAT).” Building and Environment 114 (March):429–44. https://doi.org/10.1016/j.buildenv.2016.12.035.",0,"Namazkhan, Maliheh, Casper Albers, and Linda Steg. 2020. “A Decision Tree Method for Explaining Household Gas Consumption: The Role of Building Characteristics, Socio-Demographic Variables, Psychological Factors and Household Behaviour.” Renewable and Sustainable Energy Reviews 119 (March). https://doi.org/10.1016/j.rser.2019.109542.

Brounen, Dirk, Nils Kok, and John M. Quigley. 2012. “Residential Energy Use and Conservation: Economics and Demographics.” European Economic Review 56 (5): 931–45. https://doi.org/10.1016/j.euroecorev.2012.02.007.

",0,"Wiesmann, Daniel, Inĉs Lima Azevedo, Paulo Ferrão, and John E. Fernández. 2011. “Residential Electricity Consumption in Portugal: Findings from Top-down and Bottom-up Models.” Energy Policy 39 (5): 2772–79. https://doi.org/10.1016/j.enpol.2011.02.047.

Newton, Peter, and Denny Meyer. 2012. “The Determinants of Urban Resource Consumption.” Environment and Behavior 44 (1): 107–35. https://doi.org/10.1177/0013916510390494.",0
