Independents,Total Energy Consumption Increase,Total Energy Consumption Decrease,Energy Use Intensity Increase,Energy Use Intensity Decrease,Electricity Consumption Increase,Electricity Consumption Decrease,Heating Consumption Increase,Heating Consumption Decrease,Cooling Consumption Increase,Cooling Consumption Decrease,Gas Consumption Increase,Gas Consumption Decrease,Energy Per Capita Increase,Energy Per Capita Decrease
Occupants' age,"Belaïd, Fateh, David Roubaud, and Emilios Galariotis. 2019. “Features of Residential Energy Consumption: Evidence from France Using an Innovative Multilevel Modelling Approach.” Energy Policy 125 (February):277–85. https://doi.org/10.1016/j.enpol.2018.11.007.

Burnett, J. Wesley, and L. Lynne Kiesling. 2022. “How Do Machines Predict Energy Use? Comparing Machine Learning Approaches for Modeling Household Energy Demand in the United States.” Energy Research and Social Science 91 (September). https://doi.org/10.1016/j.erss.2022.102715. 

Estiri, Hossein, and Emilio Zagheni. 2019. “Age Matters: Ageing and Household Energy Demand in the United States.” Energy Research and Social Science 55 (September):62–70. https://doi.org/10.1016/j.erss.2019.05.006.

Froemelt, Andreas, René Buffat, and Stefanie Hellweg. 2020. “Machine Learning Based Modeling of Households: A Regionalized Bottom-up Approach to Investigate Consumption-Induced Environmental Impacts.” Journal of Industrial Ecology 24 (3): 639–52. https://doi.org/10.1111/jiec.12969.

Belaïd, Fateh. 2016. “Understanding the Spectrum of Domestic Energy Consumption: Empirical Evidence from France.” Energy Policy 92 (May):220–33. https://doi.org/10.1016/j.enpol.2016.02.015.

Wang, Lan, Eric W.M. Lee, Syed Asad Hussian, Anthony Chun Yin Yuen, and Wei Feng. 2021. “Quantitative Impact Analysis of Driving Factors on Annual Residential Building Energy End-Use Combining Machine Learning and Stochastic Methods.” Applied Energy 299 (October). https://doi.org/10.1016/j.apenergy.2021.117303.

Elnakat, Afamia, Juan D. Gomez, and Nathlie Booth. 2016. “A Zip Code Study of Socioeconomic, Demographic, and Household Gendered Influence on the Residential Energy Sector.” Energy Reports 2 (November):21–27. https://doi.org/10.1016/j.egyr.2016.01.003.

Jiang, Tingting, Hongyang Li, Peng Mao, Tongyuan Wu, Martin Skitmore, and Nima Talebian. 2023. “Strategy of Energy Conservation and Emission Reduction in Residential Building Sector: A Case Study of Jiangsu Province, China.” Edited by Yibin Ao. Journal of Environmental and Public Health 2023 (January):1–13. https://doi.org/10.1155/2023/7818070.

Hu, Shan, Da Yan, Siyue Guo, Ying Cui, and Bing Dong. 2017. “A Survey on Energy Consumption and Energy Usage Behavior of Households and Residential Building in Urban China.” Energy and Buildings 148 (August):366–78. https://doi.org/10.1016/j.enbuild.2017.03.064.",0,0,0,"Bardazzi, Rossella, and Maria Grazia Pazienza. 2020. “When I Was Your Age: Generational Effects on Long-Run Residential Energy Consumption in Italy.” Energy Research and Social Science 70 (December). https://doi.org/10.1016/j.erss.2020.101611.

Huang, Wen Hsiu. 2015. “The Determinants of Household Electricity Consumption in Taiwan: Evidence from Quantile Regression.” Energy 87 (July):120–33. https://doi.org/10.1016/j.energy.2015.04.101.

Kostakis, Ioannis. 2020. “Socio-Demographic Determinants of Household Electricity Consumption: Evidence from Greece Using Quantile Regression Analysis.” Current Research in Environmental Sustainability 1 (January):23–30. https://doi.org/10.1016/j.crsust.2020.04.001.

Li, Chaosu, Yan Song, and Nikhil Kaza. 2018. “Urban Form and Household Electricity Consumption: A Multilevel Study.” Energy and Buildings 158 (January):181–93. https://doi.org/10.1016/j.enbuild.2017.10.007.",0,"Mostafavi, Nariman, Mohamad Farzinmoghadam, and Simi Hoque. 2017. “Urban Residential Energy Consumption Modeling in the Integrated Urban Metabolism Analysis Tool (IUMAT).” Building and Environment 114 (March):429–44. https://doi.org/10.1016/j.buildenv.2016.12.035.

",0,0,"Mostafavi, Nariman, Mohamad Farzinmoghadam, and Simi Hoque. 2017. “Urban Residential Energy Consumption Modeling in the Integrated Urban Metabolism Analysis Tool (IUMAT).” Building and Environment 114 (March):429–44. https://doi.org/10.1016/j.buildenv.2016.12.035.

Yun, Geun Young, and Koen Steemers. 2011. “Behavioural, Physical and Socio-Economic Factors in Household Cooling Energy Consumption.” Applied Energy 88 (6): 2191–2200. https://doi.org/10.1016/j.apenergy.2011.01.010.

Steemers, Koen, and Geun Young Yun. 2009. “Household Energy Consumption: A Study of the Role of Occupants.” Building Research and Information 37 (5–6): 625–37. https://doi.org/10.1080/09613210903186661.","Bardazzi, Rossella, and Maria Grazia Pazienza. 2020. “When I Was Your Age: Generational Effects on Long-Run Residential Energy Consumption in Italy.” Energy Research and Social Science 70 (December). https://doi.org/10.1016/j.erss.2020.101611.

Brounen, Dirk, Nils Kok, and John M. Quigley. 2012. “Residential Energy Use and Conservation: Economics and Demographics.” European Economic Review 56 (5): 931–45. https://doi.org/10.1016/j.euroecorev.2012.02.007.

",0,"Wang, Lan, Eric W.M. Lee, Syed Asad Hussian, Anthony Chun Yin Yuen, and Wei Feng. 2021. “Quantitative Impact Analysis of Driving Factors on Annual Residential Building Energy End-Use Combining Machine Learning and Stochastic Methods.” Applied Energy 299 (October). https://doi.org/10.1016/j.apenergy.2021.117303.

Elnakat, Afamia, Juan D. Gomez, and Nathlie Booth. 2016. “A Zip Code Study of Socioeconomic, Demographic, and Household Gendered Influence on the Residential Energy Sector.” Energy Reports 2 (November):21–27. https://doi.org/10.1016/j.egyr.2016.01.003.",0
Gender (male),0,0,0,0,"Bardazzi, Rossella, and Maria Grazia Pazienza. 2020. “When I Was Your Age: Generational Effects on Long-Run Residential Energy Consumption in Italy.” Energy Research and Social Science 70 (December). https://doi.org/10.1016/j.erss.2020.101611.

Huang, Wen Hsiu. 2015. “The Determinants of Household Electricity Consumption in Taiwan: Evidence from Quantile Regression.” Energy 87 (July):120–33. https://doi.org/10.1016/j.energy.2015.04.101.","Kostakis, Ioannis. 2020. “Socio-Demographic Determinants of Household Electricity Consumption: Evidence from Greece Using Quantile Regression Analysis.” Current Research in Environmental Sustainability 1 (January):23–30. https://doi.org/10.1016/j.crsust.2020.04.001.",0,0,0,0,0,0,0,0
Household size,"Belaïd, Fateh, David Roubaud, and Emilios Galariotis. 2019. “Features of Residential Energy Consumption: Evidence from France Using an Innovative Multilevel Modelling Approach.” Energy Policy 125 (February):277–85. https://doi.org/10.1016/j.enpol.2018.11.007.

Burnett, J. Wesley, and L. Lynne Kiesling. 2022. “How Do Machines Predict Energy Use? Comparing Machine Learning Approaches for Modeling Household Energy Demand in the United States.” Energy Research and Social Science 91 (September). https://doi.org/10.1016/j.erss.2022.102715.

Mostafavi, Nariman, Mohamad Farzinmoghadam, and Simi Hoque. 2017. “Urban Residential Energy Consumption Modeling in the Integrated Urban Metabolism Analysis Tool (IUMAT).” Building and Environment 114 (March):429–44. https://doi.org/10.1016/j.buildenv.2016.12.035.

Jaffar, Badria, Tadj Oreszczyn, Rokia Raslan, and Alex Summerfield. 2018. “Understanding Energy Demand in Kuwaiti Villas: Findings from a Quantitative Household Survey.” Energy and Buildings 165 (April):379–89. https://doi.org/10.1016/j.enbuild.2018.01.055.

Wilson, Bev. 2013. “Urban Form and Residential Electricity Consumption: Evidence from Illinois, USA.” Landscape and Urban Planning 115:62–71. https://doi.org/10.1016/j.landurbplan.2013.03.011.

Tso, Geoffrey K.F., and Jingjing Guan. 2014. “A Multilevel Regression Approach to Understand Effects of Environment Indicators and Household Features on Residential Energy Consumption.” Energy 66 (March):722–31. https://doi.org/10.1016/j.energy.2014.01.056.

Huebner, Gesche M., Ian Hamilton, Zaid Chalabi, David Shipworth, and Tadj Oreszczyn. 2015. “Explaining Domestic Energy Consumption – The Comparative Contribution of Building Factors, Socio-Demographics, Behaviours and Attitudes.” Applied Energy 159 (December):589–600. https://doi.org/10.1016/j.apenergy.2015.09.028.

Antonopoulos, Chrissi, Alec Trusty, and Vivek Shandas. 2019. “The Role of Building Characteristics, Demographics, and Urban Heat Islands in Shaping Residential Energy Use.” City and Environment Interactions 3 (November):100021. https://doi.org/10.1016/j.cacint.2020.100021.

Druckman, A., and T. Jackson. 2008. “Household Energy Consumption in the UK: A Highly Geographically and Socio-Economically Disaggregated Model.” Energy Policy 36 (8): 3177–92. https://doi.org/10.1016/j.enpol.2008.03.021.
","Froemelt, Andreas, René Buffat, and Stefanie Hellweg. 2020. “Machine Learning Based Modeling of Households: A Regionalized Bottom-up Approach to Investigate Consumption-Induced Environmental Impacts.” Journal of Industrial Ecology 24 (3): 639–52. https://doi.org/10.1111/jiec.12969.","Liu, Xue, Hao Tang, Yong Ding, and Da Yan. 2022. “Investigating the Performance of Machine Learning Models Combined with Different Feature Selection Methods to Estimate the Energy Consumption of Buildings.” Energy and Buildings 273 (October). https://doi.org/10.1016/j.enbuild.2022.112408.

Gao, Jingxin, Xiaoyang Zhong, Weiguang Cai, Hong Ren, Tengfei Huo, Xia Wang, and Zhifu Mi. 2019. “Dilution Effect of the Building Area on Energy Intensity in Urban Residential Buildings.” Nature Communications 10 (1). https://doi.org/10.1038/s41467-019-12852-9.","Bednar, Dominic J., Tony Gerard Reames, and Gregory A. Keoleian. 2017. “The Intersection of Energy and Justice: Modeling the Spatial, Racial/Ethnic and Socioeconomic Patterns of Urban Residential Heating Consumption and Efficiency in Detroit, Michigan.” Energy and Buildings 143 (May):25–34. https://doi.org/10.1016/j.enbuild.2017.03.028.","Bardazzi, Rossella, and Maria Grazia Pazienza. 2020. “When I Was Your Age: Generational Effects on Long-Run Residential Energy Consumption in Italy.” Energy Research and Social Science 70 (December). https://doi.org/10.1016/j.erss.2020.101611.

Huang, Wen Hsiu. 2015. “The Determinants of Household Electricity Consumption in Taiwan: Evidence from Quantile Regression.” Energy 87 (July):120–33. https://doi.org/10.1016/j.energy.2015.04.101.

Gao, Jingxin, Xiaoyang Zhong, Weiguang Cai, Hong Ren, Tengfei Huo, Xia Wang, and Zhifu Mi. 2019. “Dilution Effect of the Building Area on Energy Intensity in Urban Residential Buildings.” Nature Communications 10 (1). https://doi.org/10.1038/s41467-019-12852-9.

Sakah, Marriette, Stephane de la Rue du Can, Felix Amankwah Diawuo, Morkporkpor Delight Sedzro, and Christoph Kuhn. 2019. “A Study of Appliance Ownership and Electricity Consumption Determinants in Urban Ghanaian Households.” Sustainable Cities and Society 44 (January):559–81. https://doi.org/10.1016/j.scs.2018.10.019.

Navamuel, Elena Lasarte, Fernando Rubiera Morollón, and Blanca Moreno Cuartas. 2018. “Energy Consumption and Urban Sprawl: Evidence for the Spanish Case.” Journal of Cleaner Production 172 (January):3479–86. https://doi.org/10.1016/j.jclepro.2017.08.110.

Kostakis, Ioannis. 2020. “Socio-Demographic Determinants of Household Electricity Consumption: Evidence from Greece Using Quantile Regression Analysis.” Current Research in Environmental Sustainability 1 (January):23–30. https://doi.org/10.1016/j.crsust.2020.04.001.

Brounen, Dirk, Nils Kok, and John M. Quigley. 2012. “Residential Energy Use and Conservation: Economics and Demographics.” European Economic Review 56 (5): 931–45. https://doi.org/10.1016/j.euroecorev.2012.02.007.

Ye, Yuxiang, Steven F. Koch, and Jiangfeng Zhang. 2018. “Determinants of Household Electricity Consumption in South Africa.” Energy Economics 75 (September):120–33. https://doi.org/10.1016/j.eneco.2018.08.005.

Huebner, Gesche, David Shipworth, Ian Hamilton, Zaid Chalabi, and Tadj Oreszczyn. 2016. “Understanding Electricity Consumption: A Comparative Contribution of Building Factors, Socio-Demographics, Appliances, Behaviours and Attitudes.” Applied Energy 177 (September):692–702. https://doi.org/10.1016/j.apenergy.2016.04.075.

Zaidan, Esmat, Ammar Abulibdeh, Ahmad Alban, and Rateb Jabbar. 2022. “Motivation, Preference, Socioeconomic, and Building Features: New Paradigm of Analyzing Electricity Consumption in Residential Buildings.” Building and Environment 219 (July):109177. https://doi.org/10.1016/j.buildenv.2022.109177.

",0,"Chen, Shuqin, Nianping Li, Hiroshi Yoshino, Jun Guan, and Mark D. Levine. 2011. “Statistical Analyses on Winter Energy Consumption Characteristics of Residential Buildings in Some Cities of China.” Energy and Buildings 43 (5): 1063–70. https://doi.org/10.1016/j.enbuild.2010.09.022.","Bednar, Dominic J., Tony Gerard Reames, and Gregory A. Keoleian. 2017. “The Intersection of Energy and Justice: Modeling the Spatial, Racial/Ethnic and Socioeconomic Patterns of Urban Residential Heating Consumption and Efficiency in Detroit, Michigan.” Energy and Buildings 143 (May):25–34. https://doi.org/10.1016/j.enbuild.2017.03.028.","Yun, Geun Young, and Koen Steemers. 2011. “Behavioural, Physical and Socio-Economic Factors in Household Cooling Energy Consumption.” Applied Energy 88 (6): 2191–2200. https://doi.org/10.1016/j.apenergy.2011.01.010.

Steemers, Koen, and Geun Young Yun. 2009. “Household Energy Consumption: A Study of the Role of Occupants.” Building Research and Information 37 (5–6): 625–37. https://doi.org/10.1080/09613210903186661.",0,0,"Bardazzi, Rossella, and Maria Grazia Pazienza. 2020. “When I Was Your Age: Generational Effects on Long-Run Residential Energy Consumption in Italy.” Energy Research and Social Science 70 (December). https://doi.org/10.1016/j.erss.2020.101611.


Zhang, Junyi, Fei Teng, and Shaojie Zhou. 2020. “The Structural Changes and Determinants of Household Energy Choices and Energy Consumption in Urban China: Addressing the Role of Building Type.” Energy Policy 139 (April). https://doi.org/10.1016/j.enpol.2020.111314.",0,"Wiesmann, Daniel, Inĉs Lima Azevedo, Paulo Ferrão, and John E. Fernández. 2011. “Residential Electricity Consumption in Portugal: Findings from Top-down and Bottom-up Models.” Energy Policy 39 (5): 2772–79. https://doi.org/10.1016/j.enpol.2011.02.047.

Brounen, Dirk, Nils Kok, and John M. Quigley. 2012. “Residential Energy Use and Conservation: Economics and Demographics.” European Economic Review 56 (5): 931–45. https://doi.org/10.1016/j.euroecorev.2012.02.007.

Druckman, A., and T. Jackson. 2008. “Household Energy Consumption in the UK: A Highly Geographically and Socio-Economically Disaggregated Model.” Energy Policy 36 (8): 3177–92. https://doi.org/10.1016/j.enpol.2008.03.021.

Dar-Mousa, Rami Nabil, and Zeyad Makhamreh. 2019. “Analysis of the Pattern of Energy Consumptions and Its Impact on Urban Environmental Sustainability in Jordan: Amman City as a Case Study.” Energy, Sustainability and Society 9 (1): 15. https://doi.org/10.1186/s13705-019-0197-0.


"
Household composition (adults) ,0,0,0,0,0,"Chen, Yen Jong, Rodney H. Matsuoka, and Tzu Min Liang. 2018. “Urban Form, Building Characteristics, and Residential Electricity Consumption: A Case Study in Tainan City.” Environment and Planning B: Urban Analytics and City Science 45 (5): 933–52. https://doi.org/10.1177/2399808317690150.",0,0,0,0,0,0,0,0
Household composition (children) ,0,0,"Bansal, P, and S Quan. 2024. “Examining Behavioral Aspect of Urban Context Effect on Residential Building Energy Use in Seoul – Linking Urban Walkability to Energy.” Building and Environment 252 (March). https://doi.org/10.1016/j.buildenv.2024.111179.",0,"Bansal, P, and S Quan. 2024. “Examining Behavioral Aspect of Urban Context Effect on Residential Building Energy Use in Seoul – Linking Urban Walkability to Energy.” Building and Environment 252 (March). https://doi.org/10.1016/j.buildenv.2024.111179.","Fan, H., I. F. MacGill, and A. B. Sproul. 2015. “Statistical Analysis of Driving Factors of Residential Energy Demand in the Greater Sydney Region, Australia.” Energy and Buildings 105 (August):9–25. https://doi.org/10.1016/j.enbuild.2015.07.030.",0,0,0,0,0,0,0,0
Number of working individuals,0,0,0,0,"Kostakis, Ioannis. 2020. “Socio-Demographic Determinants of Household Electricity Consumption: Evidence from 
Greece Using Quantile Regression Analysis.” Current Research in Environmental Sustainability 1 (January):23–30. https://doi.org/10.1016/j.crsust.2020.04.001.",0,0,0,0,0,0,0,0,"Jiang, Lu, Xiaonan Shi, Shuang Wu, Bowenpeng Ding, and Yamei Chen. 2022. “What Factors Affect Household Energy Consumption in Mega-Cities? A Case Study of Guangzhou, China.” Journal of Cleaner Production 363 (August). https://doi.org/10.1016/j.jclepro.2022.132388."
Number of employees ,0,0,0,0,"Steadman, Philip, Ian Hamilton, and Stephen Evans. 2014. “Energy and Urban Built Form: An Empirical and Statistical Approach.” Building Research and Information 42 (1): 17–31. https://doi.org/10.1080/09613218.2013.808140.",0,0,0,0,0,0,"Steadman, Philip, Ian Hamilton, and Stephen Evans. 2014. “Energy and Urban Built Form: An Empirical and Statistical Approach.” Building Research and Information 42 (1): 17–31. https://doi.org/10.1080/09613218.2013.808140.",0,0
Race (non-white) ,0,0,"Bednar, Dominic J., Tony Gerard Reames, and Gregory A. Keoleian. 2017. “The Intersection of Energy and Justice: Modeling the Spatial, Racial/Ethnic and Socioeconomic Patterns of Urban Residential Heating Consumption and Efficiency in Detroit, Michigan.” Energy and Buildings 143 (May):25–34. https://doi.org/10.1016/j.enbuild.2017.03.028.

Goldstein, Benjamin, Tony G. Reames, and Joshua P. Newell. 2022. “Racial Inequity in Household Energy Efficiency and Carbon Emissions in the United States: An Emissions Paradox.” Energy Research and Social Science 84 (February). https://doi.org/10.1016/j.erss.2021.102365.","Tong, Kangkang, Anu Ramaswami, Corey Xu, Richard Feiock, Patrick Schmitz, Michael Ohlsen, and Susan Hanson. 2021. “Measuring Social Equity in Urban Energy Use and Interventions Using Fine-Scale Data.” Proceedings of the National Academy of Sciences of the United States of America 118 (24). https://doi.org/10.1073/pnas.2023554118/-/DCSupplemental.",0,0,0,0,0,0,0,0,0,0
Race (white) ,0,0,0,0,0,0,0,0,0,0,0,0,"Goldstein, Benjamin, Tony G. Reames, and Joshua P. Newell. 2022. “Racial Inequity in Household Energy Efficiency and Carbon Emissions in the United States: An Emissions Paradox.” Energy Research and Social Science 84 (February). https://doi.org/10.1016/j.erss.2021.102365.",0
