Building density ,"Mrówczyńska, Maria, Marta Skiba, Anna Bazan-Krzywoszańska, and Małgorzata Sztubecka. 2020. “Household Standards and Socio-Economic Aspects as a Factor Determining Energy Consumption in the City.” Applied Energy 264 (April). https://doi.org/10.1016/j.apenergy.2020.114680.

Silva, Ricardo, Sven Eggimann, Léonie Fierz, Massimo Fiorentini, Kristina Orehounig, and Luca Baldini. 2022. “Opportunities for Passive Cooling to Mitigate the Impact of Climate Change in Switzerland.” Building and Environment 208 (January). https://doi.org/10.1016/j.buildenv.2021.108574.

Zhang, Yan, Bak Koon Teoh, Maozhi Wu, Jiayu Chen, and Limao Zhang. 2023. “Data-Driven Estimation of Building Energy Consumption and GHG Emissions Using Explainable Artificial Intelligence.” Energy 262 (January). https://doi.org/10.1016/j.energy.2022.125468.

Zhou, Xiao, Zhou Huang, Bronte Scheuer, Han Wang, Guoqing Zhou, and Yu Liu. 2023. “High-Resolution Estimation of Building Energy Consumption at the City Level.” Energy 275 (July). https://doi.org/10.1016/j.energy.2023.127476.

Liu, Ke, Xiaodong Xu, Ran Zhang, Lingyu Kong, Wei Wang, and Wei Deng. 2023. “Impact of Urban Form on Building Energy Consumption and Solar Energy Potential: A Case Study of Residential Blocks in Jianhu, China.” Energy and Buildings 280 (February). https://doi.org/10.1016/j.enbuild.2022.112727.

Strømann-Andersen, J., and P.A. Sattrup. 2011. “The Urban Canyon and Building Energy Use: Urban Density versus Daylight and Passive Solar Gains.” Energy and Buildings 43 (8): 2011–20. https://doi.org/10.1016/j.enbuild.2011.04.007.

Trepci, Esra, Praveen Maghelal, and Elie Azar. 2020. “Effect of Densification and Compactness on Urban Building Energy Consumption: Case of a Transit-Oriented Development in Dallas, TX.” Sustainable Cities and Society 56 (May). https://doi.org/10.1016/j.scs.2019.101987.

Hachem, Caroline. 2016. “Impact of Neighborhood Design on Energy Performance and GHG Emissions.” Applied Energy 177 (September):422–34. https://doi.org/10.1016/j.apenergy.2016.05.117.","Wilson, Bev. 2013. “Urban Form and Residential Electricity Consumption: Evidence from Illinois, USA.” Landscape and Urban Planning 115:62–71. https://doi.org/10.1016/j.landurbplan.2013.03.011.

Zhu, Sijie, Yanxia Li, Shen Wei, Chao Wang, Xinkai Zhang, Xing Jin, Xin Zhou, and Xing Shi. 2022. “The Impact of Urban Vegetation Morphology on Urban Building Energy Consumption during Summer and Winter Seasons in Nanjing, China.” Landscape and Urban Planning 228 (December). https://doi.org/10.1016/j.landurbplan.2022.104576.

Creutzig, Felix, Giovanni Baiocchi, Robert Bierkandt, Peter Paul Pichler, and Karen C. Seto. 2015. “Global Typology of Urban Energy Use and Potentials for an Urbanization Mitigation Wedge.” Proceedings of the National Academy of Sciences of the United States of America 112 (20): 6283–88. https://doi.org/10.1073/pnas.1315545112.

Antonopoulos, Chrissi, Alec Trusty, and Vivek Shandas. 2019. “The Role of Building Characteristics, Demographics, and Urban Heat Islands in Shaping Residential Energy Use.” City and Environment Interactions 3 (November):100021. https://doi.org/10.1016/j.cacint.2020.100021.

Rostami, Ehsan, Nazanin Nasrollahi, and Jamal Khodakarami. 2024. “A Comprehensive Study of How Urban Morphological Parameters Impact the Solar Potential, Energy Consumption and Daylight Autonomy in Canyons and Buildings.” Energy and Buildings 305 (February):113904. https://doi.org/10.1016/j.enbuild.2024.113904.

Resch, Eirik, Rolf André Bohne, Trond Kvamsdal, and Jardar Lohne. 2016. “Impact of Urban Density and Building Height on Energy Use in Cities.” Energy Procedia 96 (September):800–814. https://doi.org/10.1016/j.egypro.2016.09.142.

Calderón, Carlos, Philip James, Javier Urquizo, and Adrian McLoughlin. 2015. “A GIS Domestic Building Framework to Estimate Energy End-Use Demand in UK Sub-City Areas.” Energy and Buildings 96 (June):236–50. https://doi.org/10.1016/j.enbuild.2015.03.029.
","Wang, Xiaolu, Yumin Tan, Guanhua Zhou, Guifei Jing, and Emolu John Francis. 2024. “A Framework for Analyzing Energy Consumption in Urban Built-up Areas Based on Single Photonic Radar and Spatial Big Data.” Energy 290 (March). https://doi.org/10.1016/j.energy.2023.130202.","Ahn, Yong Jin, and Dong Wook Sohn. 2019. “The Effect of Neighbourhood-Level Urban Form on Residential Building Energy Use: A GIS-Based Model Using Building Energy Benchmarking Data in Seattle.” Energy and Buildings 196 (August):124–33. https://doi.org/10.1016/j.enbuild.2019.05.018.

Liu, Ke, Xiaodong Xu, Ran Zhang, Lingyu Kong, Wei Wang, and Wei Deng. 2023. “Impact of Urban Form on Building Energy Consumption and Solar Energy Potential: A Case Study of Residential Blocks in Jianhu, China.” Energy and Buildings 280 (February). https://doi.org/10.1016/j.enbuild.2022.112727.

Leng, Hong, Xi Chen, Yanhong Ma, Nyuk Hien Wong, and Tingzhen Ming. 2020. “Urban Morphology and Building Heating Energy Consumption: Evidence from Harbin, a Severe Cold Region City.” Energy and Buildings 224 (October). https://doi.org/10.1016/j.enbuild.2020.110143.

Xie, Mengju, Minghao Wang, Hua Zhong, Xinxin Li, Baofeng Li, Thushini Mendis, and Shen Xu. 2023. “The Impact of Urban Morphology on the Building Energy Consumption and Solar Energy Generation Potential of University Dormitory Blocks.” Sustainable Cities and Society 96 (September). https://doi.org/10.1016/j.scs.2023.104644.

Trepci, Esra, Praveen Maghelal, and Elie Azar. 2020. “Effect of Densification and Compactness on Urban Building Energy Consumption: Case of a Transit-Oriented Development in Dallas, TX.” Sustainable Cities and Society 56 (May). https://doi.org/10.1016/j.scs.2019.101987.

Xu, Shen, Mengcheng Sang, Mengju Xie, Feng Xiong, Thushini Mendis, and Xingwei Xiang. 2023. “Influence of Urban Morphological Factors on Building Energy Consumption Combined with Photovoltaic Potential: A Case Study of Residential Blocks in Central China.” Building Simulation 16 (9): 1777–92. https://doi.org/10.1007/s12273-023-1014-4.","Steadman, Philip, Ian Hamilton, and Stephen Evans. 2014. “Energy and Urban Built Form: An Empirical and Statistical Approach.” Building Research and Information 42 (1): 17–31. https://doi.org/10.1080/09613218.2013.808140.

Ahmed Gassar, Abdo Abdullah, Geun Young Yun, and Sumin Kim. 2019. “Data-Driven Approach to Prediction of Residential Energy Consumption at Urban Scales in London.” Energy 187 (November). https://doi.org/10.1016/j.energy.2019.115973.

Kim, Hyunsoo, Youngwoo Kwon, and Yeol Choi. 2022. “Determinants of Electricity Consumption of Energy-Vulnerable Group Using Ensemble Gradient-Boosting Algorithm.” KSCE Journal of Civil Engineering 26 (12): 5010–21. https://doi.org/10.1007/s12205-022-1984-2.
","Mohammadi, Saleh, Bauke de Vries, Azarakhsh Rafiee, Masoud Esfandiari, and Eduardo Dias. 2021. “An Exploratory Study on the Impact of Physical and Geospatial Characteristics of the Urban Built Environment on the Buildings Annual Electricity Usage.” Journal of Building Engineering 40 (August). https://doi.org/10.1016/j.jobe.2021.102359.",0,"Ahn, Yong Jin, and Dong Wook Sohn. 2019. “The Effect of Neighbourhood-Level Urban Form on Residential Building Energy Use: A GIS-Based Model Using Building Energy Benchmarking Data in Seattle.” Energy and Buildings 196 (August):124–33. https://doi.org/10.1016/j.enbuild.2019.05.018.

Güneralp, Burak, Yuyu Zhou, Diana Ürge-Vorsatz, Mukesh Gupta, Sha Yu, Pralit L. Patel, Michail Fragkias, Xiaoma Li, and Karen C. Seto. 2017. “Global Scenarios of Urban Density and Its Impacts on Building Energy Use through 2050.” Proceedings of the National Academy of Sciences of the United States of America 114 (34): 8945–50. https://doi.org/10.1073/pnas.1606035114.

Leng, Hong, Xi Chen, Yanhong Ma, Nyuk Hien Wong, and Tingzhen Ming. 2020. “Urban Morphology and Building Heating Energy Consumption: Evidence from Harbin, a Severe Cold Region City.” Energy and Buildings 224 (October). https://doi.org/10.1016/j.enbuild.2020.110143.

Liu, Xiaochen, and John Sweeney. 2012. “Modelling the Impact of Urban Form on Household Energy Demand and Related CO2 Emissions in the Greater Dublin Region.” Energy Policy 46 (July):359–69. https://doi.org/10.1016/j.enpol.2012.03.070.

Li, Gaomei, Cheng Sun, Mengcheng Sang, Shuqin Chen, Jinjin Li, Yunsun Han, and Shen Xu. 2024. “The Synergistic Effect of Multiple Design Factors on Building Energy Consumption of Office Blocks: A Case Study of Wuhan, China.” Journal of Building Engineering 95 (October):110200. https://doi.org/10.1016/j.jobe.2024.110200.

Liu, Jiying, Mohammad Heidarinejad, Stefan Gracik, and Jelena Srebric. 2015. “The Impact of Exterior Surface Convective Heat Transfer Coefficients on the Building Energy Consumption in Urban Neighborhoods with Different Plan Area Densities.” Energy and Buildings 86 (January):449–63. https://doi.org/10.1016/j.enbuild.2014.10.062.","Silva, Ricardo, Sven Eggimann, Léonie Fierz, Massimo Fiorentini, Kristina Orehounig, and Luca Baldini. 2022. “Opportunities for Passive Cooling to Mitigate the Impact of Climate Change in Switzerland.” Building and Environment 208 (January). https://doi.org/10.1016/j.buildenv.2021.108574.

Ahmed Gassar, Abdo Abdullah, Geun Young Yun, and Sumin Kim. 2019. “Data-Driven Approach to Prediction of Residential Energy Consumption at Urban Scales in London.” Energy 187 (November). https://doi.org/10.1016/j.energy.2019.115973.

Liu, Jiying, Mohammad Heidarinejad, Stefan Gracik, and Jelena Srebric. 2015. “The Impact of Exterior Surface Convective Heat Transfer Coefficients on the Building Energy Consumption in Urban Neighborhoods with Different Plan Area Densities.” Energy and Buildings 86 (January):449–63. https://doi.org/10.1016/j.enbuild.2014.10.062.","Wilson, Bev. 2013. “Urban Form and Residential Electricity Consumption: Evidence from Illinois, USA.” Landscape and Urban Planning 115:62–71. https://doi.org/10.1016/j.landurbplan.2013.03.011.

Zhu, Sijie, Yanxia Li, Shen Wei, Chao Wang, Xinkai Zhang, Xing Jin, Xin Zhou, and Xing Shi. 2022. “The Impact of Urban Vegetation Morphology on Urban Building Energy Consumption during Summer and Winter Seasons in Nanjing, China.” Landscape and Urban Planning 228 (December). https://doi.org/10.1016/j.landurbplan.2022.104576.",0,"Steadman, Philip, Ian Hamilton, and Stephen Evans. 2014. “Energy and Urban Built Form: An Empirical and Statistical Approach.” Building Research and Information 42 (1): 17–31. https://doi.org/10.1080/09613218.2013.808140.

Movahedi, Ali, and Sybil Derrible. 2021. “Interrelationships between Electricity, Gas, and Water Consumption in Large-Scale Buildings.” Journal of Industrial Ecology 25 (4): 932–47. https://doi.org/10.1111/jiec.13097.",0,"Parshall, Lily, Kevin Gurney, Stephen A. Hammer, Daniel Mendoza, 
Yuyu Zhou, and Sarath Geethakumar. 2010. “Modeling Energy Consumption and CO2 Emissions at the Urban Scale: Methodological Challenges and Insights from the United States.” Energy Policy 38 (9): 4765–82. https://doi.org/10.1016/j.enpol.2009.07.006."
Building coverage ratio,"Zhou, Xiao, Zhou Huang, Bronte Scheuer, Han Wang, Guoqing Zhou, and Yu Liu. 2023. “High-Resolution Estimation of Building Energy Consumption at the City Level.” Energy 275 (July). https://doi.org/10.1016/j.energy.2023.127476.",0,"Bansal, P, and S Quan. 2024. “Examining Behavioral Aspect of Urban Context Effect on Residential Building Energy Use in Seoul – Linking Urban Walkability to Energy.” Building and Environment 252 (March). https://doi.org/10.1016/j.buildenv.2024.111179.

Bansal, Parth, and Steven Jige Quan. 2022. “Relationships between Building Characteristics, Urban Form and Building Energy Use in Different Local Climate Zone Contexts: An Empirical Study in Seoul.” Energy and Buildings 272 (October). https://doi.org/10.1016/j.enbuild.2022.112335.

Cui, Peng, Jiaqi Lu, Yutong Wu, Jingnan Tang, and Jinjian Jiang. 2024. “Effect of Urban Morphology on Microclimate and Building Cluster Energy Consumption in Cold Regions of China.” Sustainable Cities and Society 115 (November):105838. https://doi.org/10.1016/j.scs.2024.105838.

Li, Gaomei, Cheng Sun, Mengcheng Sang, Shuqin Chen, Jinjin Li, Yunsun Han, and Shen Xu. 2024. “The Synergistic Effect of Multiple Design Factors on Building Energy Consumption of Office Blocks: A Case Study of Wuhan, China.” Journal of Building Engineering 95 (October):110200. https://doi.org/10.1016/j.jobe.2024.110200.",0,"Lim, Jaebin, and Myounggu Kang. 2022. “The Relationship between Site Planning and Electricity Consumption: An Empirical Analysis of Multi-Unit Residential Complexes in Seoul, Korea.” Environment and Planning B: Urban Analytics and City Science 
49 (3): 971–86. https://doi.org/10.1177/23998083211039855.",0,0,0,0,0,0,0,0,0
Open space ratio,0,0,"Liu, Ke, Xiaodong Xu, Ran Zhang, Lingyu Kong, Wei Wang, and Wei Deng. 2023. “Impact of Urban Form on Building Energy Consumption and Solar Energy Potential: A Case Study of Residential Blocks in Jianhu, China.” Energy and Buildings 280 (February). https://doi.org/10.1016/j.enbuild.2022.112727.",0,0,0,0,0,0,0,0,0,0,0
Compactness,"Miao, Lu. 2017. “Examining the Impact Factors of Urban Residential Energy Consumption and CO 2 Emissions in China – Evidence from City-Level Data.” Ecological Indicators 73 (February):29–37. https://doi.org/10.1016/j.ecolind.2016.09.031.

Trepci, Esra, Praveen Maghelal, and Elie Azar. 2020. “Effect of Densification and Compactness on Urban Building Energy Consumption: Case of a Transit-Oriented Development in Dallas, TX.” Sustainable Cities and Society 56 (May). https://doi.org/10.1016/j.scs.2019.101987.

Ye, Hong, XiaoYan He, Yu Song, Xinhu Li, Guoqin Zhang, Tao Lin, and Lishan Xiao. 2015. “A Sustainable Urban Form: The Challenges of Compactness from the Viewpoint of Energy Consumption and Carbon Emission.” Energy and Buildings 93 (April):90–98. https://doi.org/10.1016/j.enbuild.2015.02.011.

Hadavi, Mohammad, and Hadi Pasdarshahri. 2021. “Investigating Effects of Urban Configuration and Density on Urban Climate and Building Systems Energy Consumption.” Journal of Building Engineering 44 (December):102710. https://doi.org/10.1016/j.jobe.2021.102710.","Marique, Anne Franoise, and Sigrid Reiter. 2012. “A Method to Evaluate the Energy Consumption of Suburban Neighborhoods.” In HVAC and R Research, 18:88–99. https://doi.org/10.1080/10789669.2011.592103.",0,"Trepci, Esra, Praveen Maghelal, and Elie Azar. 2020. “Effect of Densification and Compactness on Urban Building Energy Consumption: 
Case of a Transit-Oriented Development in Dallas, TX.” Sustainable Cities and Society 56 (May). https://doi.org/10.1016/j.scs.2019.101987.",0,"Ki, Jaehong, and D.K. Yoon. 2024. “The Impact of Urban Form on Residential Electricity Consumption: 
Panel Data Analyses of South Korean Urban Municipalities.” Energy Policy 186 (March):113986. https://doi.org/10.1016/j.enpol.2024.113986.",0,"Braulio-Gonzalo, Marta, María Dolores Bovea, María José Ruá, and Pablo Juan. 2016. “A Methodology for Predicting the Energy Performance and Indoor Thermal Comfort of Residential Stocks on the Neighbourhood and City Scales. A Case Study in Spain.” Journal of Cleaner Production 139 (December):646–65. https://doi.org/10.1016/j.jclepro.2016.08.059.

Liu, Xiaochen, and John Sweeney. 2012. “Modelling the Impact of Urban Form on Household Energy Demand and Related CO2 Emissions in the Greater Dublin Region.” Energy Policy 46 (July):359–69. https://doi.org/10.1016/j.enpol.2012.03.070.

Martilli, A. 2014. “An Idealized Study of City Structure, Urban Climate, Energy Consumption, and Air Quality.” Urban Climate 10 (2): 430–46. https://doi.org/10.1016/j.uclim.2014.03.003.

","Braulio-Gonzalo, Marta, María Dolores Bovea, María José Ruá, and Pablo Juan. 2016. “A Methodology for Predicting the Energy Performance and Indoor Thermal Comfort of Residential Stocks on the Neighbourhood and City Scales. A Case Study in Spain.” Journal of Cleaner Production 139 (December):646–65. https://doi.org/10.1016/j.jclepro.2016.08.059.","Martilli, A. 2014. “An Idealized Study of City Structure, Urban Climate, Energy Consumption, and Air Quality.” Urban Climate 10 (2): 430–46. 
https://doi.org/10.1016/j.uclim.2014.03.003.",0,0,0,0
Occupancy density,0,0,"Liu, Xue, Hao Tang, Yong Ding, and Da Yan. 2022. “Investigating the Performance of Machine Learning Models Combined with Different Feature Selection Methods to Estimate the Energy Consumption of Buildings.” Energy and Buildings 273 (October). https://doi.org/10.1016/j.enbuild.2022.112408.

Bansal, P, and S Quan. 2024. “Examining Behavioral Aspect of Urban Context Effect on Residential Building Energy Use in Seoul – Linking Urban Walkability to Energy.” Building and Environment 252 (March). https://doi.org/10.1016/j.buildenv.2024.111179.",0,"Bansal, P, and S Quan. 2024. “Examining Behavioral Aspect of Urban Context Effect on Residential Building Energy Use in Seoul – Linking Urban Walkability to Energy.” Building and Environment 252 (March). https://doi.org/10.1016/j.buildenv.2024.111179.",0,0,0,0,0,0,0,0,0
Population density,0,"Froemelt, Andreas, René Buffat, and Stefanie Hellweg. 2020. “Machine Learning Based Modeling of Households: A Regionalized Bottom-up Approach to Investigate Consumption-Induced Environmental Impacts.” Journal of Industrial Ecology 24 (3): 639–52. https://doi.org/10.1111/jiec.12969.

Porse, Erik, Joshua Derenski, Hannah Gustafson, Zoe Elizabeth, and Stephanie Pincetl. 2016. “Structural, Geographic, and Social Factors in Urban Building Energy Use: Analysis of Aggregated Account-Level Consumption Data in a Megacity.” Energy Policy 96 (September):179–92. https://doi.org/10.1016/j.enpol.2016.06.002.

Güneralp, Burak, Yuyu Zhou, Diana Ürge-Vorsatz, Mukesh Gupta, Sha Yu, Pralit L. Patel, Michail Fragkias, Xiaoma Li, and Karen C. Seto. 2017. “Global Scenarios of Urban Density and Its Impacts on Building Energy Use through 2050.” Proceedings of the National Academy of Sciences of the United States of America 114 (34): 8945–50. https://doi.org/10.1073/pnas.1606035114.

Creutzig, Felix, Giovanni Baiocchi, Robert Bierkandt, Peter Paul Pichler, and Karen C. Seto. 2015. “Global Typology of Urban Energy Use and Potentials for an Urbanization Mitigation Wedge.” Proceedings of the National Academy of Sciences of the United States of America 112 (20): 6283–88. https://doi.org/10.1073/pnas.1315545112.

Mashhoodi, Bardia, Dominic Stead, and Arjan Van Timmeren. 2020. “Local and National Determinants of Household Energy Consumption in the Netherlands.” GeoJournal 85 (2): 393–406. https://doi.org/10.1007/s10708-018-09967-9.","Jiang, Lu, Xiaonan Shi, Shuang Wu, Bowenpeng Ding, and Yamei Chen. 2022. “What Factors Affect Household Energy Consumption in Mega-Cities? A Case Study of Guangzhou, China.” Journal of Cleaner Production 363 (August). https://doi.org/10.1016/j.jclepro.2022.132388.

Porse, Erik, Joshua Derenski, Hannah Gustafson, Zoe Elizabeth, and Stephanie Pincetl. 2016. “Structural, Geographic, and Social Factors in Urban Building Energy Use: Analysis of Aggregated Account-Level Consumption Data in a Megacity.” Energy Policy 96 (September):179–92. https://doi.org/10.1016/j.enpol.2016.06.002.",0,"Chen, Yen Jong, Rodney H. Matsuoka, and Tzu Min Liang. 2018. “Urban Form, Building Characteristics, and Residential Electricity Consumption: A Case Study in Tainan City.” Environment and Planning B: Urban Analytics and City Science 45 (5): 933–52. https://doi.org/10.1177/2399808317690150.

Reyna, Janet L., and Mikhail V. Chester. 2017. “Energy Efficiency to Reduce Residential Electricity and Natural Gas Use under Climate Change.” Nature Communications 8 (May). https://doi.org/10.1038/ncomms14916.","Ki, Jaehong, and D.K. Yoon. 2024. “The Impact of Urban Form on Residential Electricity Consumption: 
Panel Data Analyses of South Korean Urban Municipalities.” Energy Policy 186 (March):113986. https://doi.org/10.1016/j.enpol.2024.113986.",0,0,0,"Ko, Yekang, and John D Radke. 2014. “The Effect of Urban Form and Residential Cooling Energy Use in Sacramento, California.” Environment and Planning B: Planning and Design 41 (4): 573–93. https://doi.org/10.1068/b12038p.",0,0,0,"Güneralp, Burak, Yuyu Zhou, Diana Ürge-Vorsatz, Mukesh Gupta, Sha Yu, Pralit L. Patel, Michail Fragkias, Xiaoma Li, and Karen C. Seto. 2017. “Global Scenarios of Urban Density and Its Impacts on Building Energy Use through 2050.” Proceedings of the National Academy of Sciences of the United States of America 114 (34): 8945–50. https://doi.org/10.1073/pnas.1606035114.

Elnakat, Afamia, Juan D. Gomez, and Nathlie Booth. 2016. “A Zip Code Study of Socioeconomic, Demographic, and Household Gendered Influence on the Residential Energy Sector.” Energy Reports 2 (November):21–27. https://doi.org/10.1016/j.egyr.2016.01.003."
Urban canyons (Height/Width Ratio),"Mangan, Suzi Dilara, Gul Koclar Oral, Idil Erdemir Kocagil, and Irem Sozen. 2021. “The Impact of Urban Form on Building Energy and Cost Efficiency in Temperate-Humid Zones.” Journal of Building Engineering 33 (January):101626. https://doi.org/10.1016/j.jobe.2020.101626.


Strømann-Andersen, J., and P.A. Sattrup. 2011. “The Urban Canyon and Building Energy Use: Urban Density versus Daylight and Passive Solar Gains.” Energy and Buildings 43 (8): 2011–20. https://doi.org/10.1016/j.enbuild.2011.04.007.

Mirashk-Daghiyan, Maryam, Atefeh Dehghan-Touran-Poshti, Azadeh Shahcheragi, and Mohammad Hadi Kaboli. 2022. “The Effect of Surrounding Buildings’ Height and the Width of the Street on a Building’s Energy Consumption.” International Journal of Energy and Environmental Engineering 13 (1): 207–17. https://doi.org/10.1007/s40095-021-00420-1.

Mangan, Suzi Dilara, and Gül Koçlar Oral. 2020. “Impacts of Future Weather Data on the Energy Performance of Buildings in the Context of Urban Geometry.” Edited by Giuseppe Brando. Cogent Engineering 7 (1): 1714112. https://doi.org/10.1080/23311916.2020.1714112.",0,0,"Chen, Yen Jong, Rodney H. Matsuoka, and Tzu Min Liang. 2018. “Urban Form, Building Characteristics, and Residential Electricity Consumption: A Case Study in Tainan City.” Environment and Planning B: Urban Analytics and City Science 45 (5): 933–52. https://doi.org/10.1177/2399808317690150.

Leng, Hong, Xi Chen, Yanhong Ma, Nyuk Hien Wong, and Tingzhen Ming. 2020. “Urban Morphology and Building Heating Energy Consumption: Evidence from Harbin, a Severe Cold Region City.” Energy and Buildings 224 (October). https://doi.org/10.1016/j.enbuild.2020.110143.",0,"Chen, Yen Jong, Rodney H. Matsuoka, and Tzu Min Liang. 2018. “Urban Form, Building Characteristics, and Residential Electricity Consumption: A Case Study in Tainan City.” Environment and Planning B: Urban Analytics and City Science 45 (5): 933–52. https://doi.org/10.1177/2399808317690150.","Mangan, Suzi Dilara, and Gül Koçlar Oral. 2020. “Impacts of Future Weather Data on the Energy Performance of Buildings in the Context of Urban Geometry.” Edited by Giuseppe Brando. Cogent Engineering 7 (1): 1714112. https://doi.org/10.1080/23311916.2020.1714112.","Leng, Hong, Xi Chen, Yanhong Ma, Nyuk Hien Wong, and Tingzhen Ming. 2020. “Urban Morphology and Building Heating Energy Consumption: Evidence from Harbin, a Severe Cold Region City.” Energy and Buildings 224 (October). https://doi.org/10.1016/j.enbuild.2020.110143.

Mangan, Suzi Dilara, Gul Koclar Oral, Idil Erdemir Kocagil, and Irem Sozen. 2021. “The Impact of Urban Form on Building Energy and Cost Efficiency in Temperate-Humid Zones.” Journal of Building Engineering 33 (January):101626. https://doi.org/10.1016/j.jobe.2020.101626.",0,"Streicher, Kai Nino, Pierryves Padey, David Parra, Meinrad C. Bürer, Stefan Schneider, and Martin K. Patel. 2019. “Analysis of Space Heating Demand in the Swiss Residential Building Stock: Element-Based Bottom-up Model of Archetype Buildings.” Energy and Buildings 184 (February):300–322. https://doi.org/10.1016/j.enbuild.2018.12.011.

Braulio-Gonzalo, Marta, María Dolores Bovea, María José Ruá, and Pablo Juan. 2016. “A Methodology for Predicting the Energy Performance and Indoor Thermal Comfort of Residential Stocks on the Neighbourhood and City Scales. A Case Study in Spain.” Journal of Cleaner Production 139 (December):646–65. https://doi.org/10.1016/j.jclepro.2016.08.059.

Mangan, Suzi Dilara, Gul Koclar Oral, Idil Erdemir Kocagil, and Irem Sozen. 2021. “The Impact of Urban Form on Building Energy and Cost Efficiency in Temperate-Humid Zones.” Journal of Building Engineering 33 (January):101626. https://doi.org/10.1016/j.jobe.2020.101626.

Huang, Kuo-Tsang, and Yi-Jhen Li. 2017. “Impact of Street Canyon Typology on Building’s Peak Cooling Energy Demand: A Parametric Analysis Using Orthogonal Experiment.” Energy and Buildings 154 (November):448–64. https://doi.org/10.1016/j.enbuild.2017.08.054.

Mangan, Suzi Dilara, and Gül Koçlar Oral. 2020. “Impacts of Future Weather Data on the Energy Performance of Buildings in the Context of Urban Geometry.” Edited by Giuseppe Brando. Cogent Engineering 7 (1): 1714112. https://doi.org/10.1080/23311916.2020.1714112.",0,0,0,0
